229997,3073579,1417 DE KALB AVENUE,3,3235,49,3032350049,28,216,"STEPHEN FICANO, JENNIE FICANO, MARILYN MANFREDI, BARBARA ODONNELL, JOANNE GUADALUPE",STEPHEN FICANO ENTERPRISES INC,587 SENECA AVENUE 11385,479,28
230000,3073578,1421 DE KALB AVENUE,3,3235,48,3032350048,5,31,"BERNARD HERNANDEZ, MARIE HALE, STEPHANIE MARTINEZ",539 COSTER STREET LLC,4018 190TH STREET 11358,288,5
230002,3073577,1423 DE KALB AVENUE,3,3235,47,3032350047,149,465,"MATTHEW AHDOOT, NIKOLAOS LEONARDOS, MATHEW AHDOOT, MINOO AHDOOT, MATT AHDOOT",UNITED FRANKLIN LLC,14718 HILLSIDE AVENUE 11435,13,1581
230007,3073575,1429 DE KALB AVENUE,3,3235,45,3032350045,28,216,"STEPHEN FICANO, JENNIE FICANO, MARILYN MANFREDI, BARBARA ODONNELL, JOANNE GUADALUPE",STEPHEN FICANO ENTERPRISES INC,587 SENECA AVENUE 11385,479,28
230011,3073828,1434 DE KALB AVENUE,3,3246,21,3032460021,41,351,"MOSHE DEUTSCH, MOSHE DEUTCH, ZALMEN WAGSCHALL, ZALMEN WAGSCHAL, SARAH GRUNHUT",FINDLAY ESTATES LLC,1049 EAST 15TH STREET OFFICE 11230,7,766
230042,3339375,1499 DE KALB AVENUE,3,3236,50,3032360050,27,562,"MAURICE SOHAYE, MANOOCHEHR HAIMOF, MAJID KAHEN, MAURICE SOHA, MAURICE SOHAY",LIVINGSTON I LLC,95 DELANCEY STREET 206 10002,33,71
230045,3073625,1501 DE KALB AVENUE,3,3236,49,3032360049,131,6498,"ANTHONY PAGAN, ALEXANDER SARI, TAMER KAYACAN, HEATHER PEATY, RYAN SOLARI",NEW BEDFORD MANAGEMENT,210 EAST 23RD STREET 5FLOOR 10010,0,1152
230046,3073870,1502 DE KALB AVENUE,3,3247,21,3032470021,1,6,"MORDECHAI TASMA, FRANCISCO PIMENTEL",1502 DEKALB LLC,2987 MARION AVENUE 10458,488,1
230073,3073631,1549 DE KALB AVENUE,3,3237,1,3032370001,45,338,"EDEN ASHOURZADEH, CATHERINE LLOPIS, JACKIE ORTIZ, ALEX KAHEN, ALON ASHOURZADEH",296-298 NORTH 8TH STREET LLC,377 PARK AVENUE SOUTH 5FLOOR 10016,256,46
230082,3073657,1567 DE KALB AVENUE,3,3237,56,3032370056,1,8,"ANTHONY ZARRA, JOSEPHINE ZARRA",ANNA ZARA TRUST,1567 DE KALB AVENUE 2R 11237,486,1
230247,3055155,461 DE KALB AVENUE,3,1925,58,3019250058,68,3091,"MATTHEW BECKER, MARC FLYNN, ELIZABETH ROSADO, LYNETTE DAVIS, JAYME ROSSKOPF",SIMPLY BETTER APARTMENT HOMES,1075 GERARD AVENUE 10452,318,69
231592,3079658,1050 DECATUR STREET,3,3433,13,3034330013,56,217,"JOSEPH YAAKOVZADEH, RABIA YAGHOUBZADEH, RABI YAGHOUBZADEH, AL KALFA, MOSES MARZAK",26 BRICKS LLC,1486 FULTON STREET GROUND 11216,188,56
231781,3079832,1362 DECATUR STREET,3,3437,34,3034370034,1,6,ELI YADID,1362 DECATUR LLC,195 PLYMOUTH STREET 11201,499,1
231972,3053541,35 DECATUR STREET,3,1855,64,3018550064,1,6,"JOHN BERCZUK, MICHAEL WECHSLER, LINDA IPPOLITO",NEW BEDFORD MGT CORP,1035 WEST MOOR DRIVE 100 80021,459,1
232070,3047629,442 DECATUR STREET,3,1683,11,3016830011,29,313,"ALEXANDER HORN, SAM KOORIS, CURTIS STORY, ALEX HORN, SAMUEL KOORIS",INWICK PARTNERS LLC,160 BROADWAY 501 10038,239,29
234898,3084595,739 DUMONT AVENUE,3,3792,55,3037920055,32,401,JAY LUBIN,PARK ROGERS REALTY LLC,674 FOURTH AVENUE 11232,351,32
236406,3126584,570 EAST 2 STREET,3,5385,22,3053850022,17,371,"ELU HAR, CHARLES ROSENWASSER, ELY HAR, JONATHON SPECTOR, ZAUR LAVEN",ELY MGT LLC,1820 AVENUE M 11230,243,17
245751,3121157,630 MARLBOROUGH ROAD,3,5235,25,3052350025,1,8,JEAN LAGUERRE,J56 PROPERTIES CORP,10913 FRANKLIN AVENUE 11205,528,1
247121,3118757,410 EAST 17 STREET,3,5159,23,3051590023,3,64,"SHOLOM RUBASHKIN, SHOLOM RINASHKIZ, SHALOM RIBOSHKIN, SHOLOM RUBOSHLEIN",452 53RD ST REATY CORP,580 CROWN STREET 306 11213,360,3
249288,3199861,2249 EAST 21 STREET,3,7354,42,3073540042,4,165,IRA EPSTEIN,I&E AND R&E MANAGEMENT,2167 EAST 21ST STREET 149 11229,354,4
264702,3110302,491 EAST 45 STREET,3,4913,1,3049130001,1,16,"ALAIN FILS-AIME, FRANCK FILS-AIME",491 E 45TH STREET REALTY CORP,491 EAST 45TH STREET 1C 11203,524,1
267353,3100189,166 EAST 51 STREET,3,4620,12,3046200012,1,6,"MARIE ERTA DIMANCHE, WIENER DIMANCHE, MARIE ERTA;DIMANCHE",,713 EAST 35TH STREET 11210,517,1
267701,3103778,522 EAST 51 STREET,3,4722,28,3047220028,1,6,"ANTONINE HEURTELOU, JEAN CALAS",,522 E51 STREET 11203,522,1
268318,3100251,175 EAST 52 STREET,3,4622,36,3046220036,10,592,"DANIEL ROSENTHAL, TOMAS ROSENTHAL, THOMAS ROSENTHAL, ROBERT ROSENTHAL, LUIS ALVEREZ",420 E 80TH LLC,2329 NOSTRAND AVENUE 500 11210,154,10
268443,3100912,197 EAST 52 STREET,3,4639,40,3046390040,1,6,"JULIE OPOENT, ROMERO ORABENE",,197 EAST 52ND STREET 3R 11203,518,1
270189,3103050,291 EAST 54 STREET,3,4702,59,3047020059,1,6,MARLENE ROPER,,1007 1007TH EAST 56 STREET 11234,520,1
270721,3101536,150 EAST 55 STREET,3,4660,24,3046600024,14,77,"SHEA SIGAL, MARVIN REBEW, ISRAEL KAHAN, ISRAEL KAHOR, ESTHER KAHAN",NPG MGMT,1568 49TH STREET 11219,504,14
273187,3103205,107 EAST 59 STREET,3,4707,20,3047070020,1,6,SHMUOL TAUB,SHMUOL TAUB (RECEIVER),1466 60TH STREET 11219,521,1
284569,3105144,631 EAST 96 STREET,3,4756,22,3047560022,10,93,"ASHER SUSSMAN, SHAYE SILBERSTEIN, ABRAHAM S",AA KODOSH HOLDINGS LLC,1648 61ST STREET 2FLOOR 11204,379,10
284638,3228689,888 EAST 96 STREET,3,8128,1,3081280001,4,124,"DAVID DEUTSCH, LISA DEUTSCH, WILLIE RENTA, JOVAN MAJSTOROVIC, LIMI NEZA",250 W 72 STREET LLC,9821 97TH AVENUE 11416,147,4
288457,3078855,183 ELDERT STREET,3,3411,57,3034110057,7,25,"PINCHAS HALPERIN, BEN STEIN, JULIO EDWARD, AVROHOM NEIMAN, PINCHAS GOLDBERGER",THE GARDEN MANAGEMENT INC,616 BEDFORD AVENUE B10 11249,7,766
288941,3042834,308 ELLERY STREET,3,1579,21,3015790021,6,26,"SAM TYRNAUER, SHIMON TIRNAUER, SAM TYRNOYER, MAYER GOMBO, JOE C",308 ELLERY LLC,192 MIDDLETON STREET 11206,426,6
289024,3086553,1 ELTON STREET,3,3909,8,3039090008,197,1208,"MATTHEW AHDOOT, NIKOLAOS LEONARDOS, RAMIN AHDOOT, ENRICO FERDICO, AZZAM OBEID",UNITED FRANKLIN LLC,14718 HILLSIDE AVENUE 11435,13,1581
289280,3097737,864 ELTON STREET,3,4360,31,3043600031,17,285,"RON NAHUM, AVRAHAM DISHI, AURAHAM DISHI",NAGLE AVENUE REALTY INC,571 W 183RD STREET 10033,120,31
290613,3072237,125 EVERGREEN AVENUE,3,3172,6,3031720006,65,452,"JOEL FEKETE, MOSES POLLAK, J FEKETE, M POLLAK, S BREUER",METROPOLITAN TERRACE LLC,63 FLUSHING AVENUE 299 11205,387,65
290614,3072236,127 EVERGREEN AVENUE,3,3172,5,3031720005,65,452,"JOEL FEKETE, MOSES POLLAK, J FEKETE, M POLLAK, S BREUER",METROPOLITAN TERRACE LLC,63 FLUSHING AVENUE 299 11205,387,65
292269,3121665,1429 FLATBUSH AVENUE,3,5250,10,3052500010,61,327,"YONATAN SPECTOR, YONATHAN SPECTOR, DHANI DHANIRAM, RACHEL PHIPPS, YONI SPECTOR",COBBLESTONE MANAGEMENT,466 LINCOLN PLACE 11238,236,62
292856,3115494,647 FLATBUSH AVENUE,3,5042,6,3050420006,2,14,JOHN GRAY,"423 FLATBUSH, LLC",647 FLATBUSH AVENUE 4 11225,385,2
292876,3115797,693 FLATBUSH AVENUE,3,5048,8,3050480008,13,222,"ASHRAF PALWALA, DIN MALIK, GUS RODRIGUEZ, MOHAMMAD YOUNUS, SARFARAZ LODHI",QUEENS REALTY LLC,149 WEST 28TH STREET 3FLOOR 10001,115,13
294126,3048327,684 FLUSHING AVENUE,3,1722,23,3017220023,15,268,"ERIC GOODMAN, NEVILLE MUSCAT, RICHARD KAHN, STACIE ORELL, SHELLY KATZ-BIEDERMAN",ERIC GOODMAN REALTY,307 EAST 89TH STREET G 10128,134,15
295421,3095328,268 FOUNTAIN AVENUE,3,4246,29,3042460029,13,132,"MICHAEL FRIEDMAN, JOSEPH WILLNER, JACK WEBER, YECHIEL WEBER, RUTH WITZTUM",WALNUT MANAGEMENT LLC,POB 190917TH 11219,245,13
295526,3093208,95 FOUNTAIN AVENUE,3,4156,6,3041560006,60,2227,"DAVID OBERLANDER, DANNY SALINAS, YORDI MATEO, JACOB SCHWARTZ, CARLOS SANCHEZ",609-619 WEST 135 STREET LLC,329 HEWES STREET 2FLOOR 11211,182,163
296052,3054702,94 FRANKLIN AVENUE,3,1898,41,3018980041,1,7,"MEIR SCWARTZ, MOSES STRULOVIC",TIFERES YEHUDA FAMILY TRUST,94 FRANKLIN AVENUE 1R 11205,461,1
296274,3064066,210 FREEMAN STREET,3,2513,26,3025130026,2,9,KAROLINA ROMANCZYK,,209 FREEMAN STREET 11222,468,2
297287,3057753,1156 FULTON STREET,3,2017,25,3020170025,1,5,VERNON MCCREATH,,1156 FULTON STREET 2F 11216,463,1
297296,3057433,1165 FULTON STREET,3,1999,36,3019990036,16,49,"PINHAS ABAKASISS, AVI AVIKASISS, AVI AVIKASIS, ABRAHAM AVIKASIS, SIMON VAKNIN",894-902 ROGERS AVE LLC,1915 EAST 18TH STREET 11229,405,16
297443,3053645,1449 FULTON STREET,3,1857,33,3018570033,101,2698,"PESACH MILLER, MOSHE STAHL, GEORGE ZAYAS, ARI EDELL, HARRY GARTNER",EAST 117TH REALTY LLC,102 EAST 116TH STREET ST1 10029,173,108
298165,3092124,3221 FULTON STREET,3,4127,60,3041270060,2,8,"TERRY ANN WELLINGTON, TERRYANN WELLINGTON, DOROTHY MONGOL",LIFESTYLE MGMT & INVESTMENT GROUP INC,114118 230TH STREET 11411,503,2
298513,3056622,931 FULTON STREET,3,1977,27,3019770027,3,26,"MABADEJE DEMU, AYODEJI LUKULA, PAUL OYEWOLE, MABAADEJO DEMU, CAROLYN STEELE",51 CLIFTON PLACE HDFC,51 CLIFTON PLACE 17 11238,462,3
299120,3076440,1328 GATES AVENUE,3,3342,26,3033420026,229,1592,"SALVATORE D'AVOLA, FRED BASAL, ISMENE SPELIOTIS, ALBERT BASAL, MAURICE BRISTER","PROJECT REBUILD, INC.",150 BROADWAY 2101 10038,13,1581
300569,3093471,130 GLEN STREET,3,4168,12,3041680012,42,972,"ELEANOR PATRICK, MEILECH WEISS, ARI NOE, JOEL BASCH, SHLOME REIFER",873-879 LLC,3611 14TH AVENUE 603 11218,112,44
300827,3083880,486 GLENMORE AVENUE,3,3725,10,3037250010,0,,,,,505,1
301760,3002137,27 GRACE COURT,3,251,52,3002510052,5,32,"MICHAEL CONNORS, DANNY KORZENIEWSKI, VICTOR ALVAREZ, MICHAEL O'CONNOR, MICHAEL CONNOR",HARBOUR VIEW ENTERPRISES INC,7408 FIFTH AVENUE 2 11209,341,5
301889,3081855,257 GRAFTON STREET,3,3567,14,3035670014,2,12,"HESHMATOLLAH LIAZADEH, LEON DAREO",257 GRAFTON PROPERTY GROUP LLC,1268 EAST 12TH STREET 11230,501,2
301933,3081969,337 GRAFTON STREET,3,3581,6,3035810006,72,4755,"PETER REBENWURZEL, MICHAEL HAAS, YOSSI GOLDBERG, EZRA BETECH, EPHRAIM NIERENBERG","159 BAY REALTY, LLC",1499 CONEY ISLAND AVENUE 11230,34,137
301967,3071288,138 GRAHAM AVENUE,3,3071,4,3030710004,1,6,"SMITA PATEL, DANIEL RAMLAL, NISHANT SONI",DEV REALTY LLC,38 CHELSEA DRIVE 07039,474,1
302273,3327984,97 GRAHAM AVENUE,3,3088,17,3030880017,1,6,"SAM DAVIES, MARVIN DAVIES",VADIS REALTY CORP,833 CENTRAL AVENUE 1H 11691,475,1
302444,3054577,65 GRAND AVENUE,3,1893,22,3018930022,5,28,"CHES PARNES, JOSEPHINE DELISE, CHESKY PARNES, CHES PAR",FREEMAN SUNSHINE REALTY LLC,1166 59TH STREET 11219,305,5
302963,3080370,22 GRANITE STREET,3,3461,16,3034610016,7,32,"AVROHOM SCHLAFF, STEVEN YEE, HENRY TEITELBAUM, SHIA SCHWARTZ, HENRY TEIELBAUM",ALLEY PROPERTY MANAGEMENT,1764 51ST STREET 11204,428,7
302965,3080371,24 GRANITE STREET,3,3461,17,3034610017,6,30,"SOLOMON SCHWARTZ, CHAIM JACOBOWITZ, RACHEL SCHWARTZ, SOL PERLSTEIN",289 HIMROD LLC,229 HEWES STREET 11211,452,6
302989,3080364,69 GRANITE STREET,3,3457,64,3034570064,21,136,"MENAHEM CHUKROON, MENAHEM CHUKROOM, SHIRAN OZAL, MENAHEM CHUCKROON, MENY CHUKROON",BNC HOSPITALITY LLC,354 MARCUS GARVEY BOULEVARD 11221,380,21
303236,3094034,456 GRANT AVENUE,3,4182,46,3041820046,56,407,"MOSHE DEUTSCH, ZALMEN WAGSCHALL, MOSHE DEUTCH, MOSHE DEUCH, ZALMEN WAGSCHAL",FINDLAY ESTATES LLC,1049 EAST 15TH STREET 11230,7,766
303401,3070676,89 GRATTAN STREET,3,3004,41,3030040041,84,655,"MOSHE DEUTSCH, MOSHE DEUTCH, USHER STEINMETZ, ZALMEN WAGSCHALL, MOSHE DEUCH",FINDLAY ESTATES LLC,1049 EAST 15TH STREET 11230,7,766
303732,3074966,1073 GREENE AVENUE,3,3283,40,3032830040,52,552,"IVAN VILLARRUEL, ALEX ABREU, RYAN VILLARRUEL, LUIS NAVARRO, JERRY ATKINS","SAFEGUARD REALTY MGMT, INC",120 WEST 31ST STREET 6FLOOR 10001,85,90
303776,3075066,1141 GREENE AVENUE,3,3285,86,3032850086,4,28,HERMAN JAC,LAFAYETTE PALACE LLC,503 LAFAYETTE 199 11205,453,4
303874,3075117,1361 GREENE AVENUE,3,3289,39,3032890039,148,1344,"YOEL GOLDMAN, NATHAN SCHWARCZ, NAFTALI GESTETNER, MOSHE ENGEL, HECTOR PENA",679 681 CLASSON AVE LLC,12 SPENCER STREET 4 11205,7,766
304054,3056260,252 GREENE AVENUE,3,1966,7502,3019667502,8,196,"DANIEL SABILLON, YAN KUZNETSOV, PETER BURGESS, ANDY FERATOVIC, MICHAEL WONG","DANIEL SABILLON, LLC",3111 OCEAN PARKWAY 3J 11235,371,8
304972,3076093,148 GROVE STREET,3,3323,33,3033230033,24,65,"ALI RASHID, FAISAL RASHID, DAWOOD RASHID, DANYA RASHID, FAISAL KHAN",KINGSLAND HOLDING GROUP LLC,15916 UNION TURNPIKE 11366,306,24
305581,3078698,1217 HALSEY STREET,3,3406,61,3034060061,65,452,"JOEL FEKETE, MOSES POLLAK, J FEKETE, M POLLAK, S BREUER",METROPOLITAN TERRACE LLC,63 FLUSHING AVENUE 299 11205,387,65
305591,3078694,1229 HALSEY STREET,3,3406,57,3034060057,51,1277,"ROBERT RAPHAEL, NELSON COLON, LUIS RUIZ, ISRAEL ACEVEDO, WINSTON KING",GILMAN MANAGEMENT CORP.,55 WATERMILL LANE 100 11021,27,51
305606,3078689,1245 HALSEY STREET,3,3406,50,3034060050,2,12,"RAYMOND LEVY, PAUL GOLDENBERG, DANNY LEVY",HERITAGE II LLC,244 MADISON AVENUE PMB344 10016,99,2
305624,3078916,1298 HALSEY STREET,3,3413,22,3034130022,1,6,"LEONID PINKHASOV, ARSEN DAVIDOV, OLGA KHAKHAM","1298 HALSEY, LLC",7347 173RD STREET 11366,497,1
305642,3078924,1322 HALSEY STREET,3,3413,32,3034130032,2,14,EDUARDO RIZZUTO,,18118 DALNY ROAD 11432,484,2
306235,3052618,77 HALSEY STREET,3,1837,67,3018370067,1,6,PASCAL PELAT,77 HALSEY LLC,6 FORDHAM HILL OVAL 6E 10468,457,1
306728,3078076,1351 HANCOCK STREET,3,3392,57,3033920057,8,33,"MAYER KESSLER, YAKOV TWERSKI, RICARDO DESILVA, YAKOU TWERSKI, RAIZY KNOPFLER",GREENE MANAGEMENT,1825 65TH STREET 300 11204,415,8
306882,3052306,231 HANCOCK STREET,3,1833,46,3018330046,3,13,RAFAEL REIHANIAN,MERAKI PROPERTIES LLC,277 NORTHERN BOULEVARD 100 11021,445,3
307108,3057452,46 HANCOCK STREET,3,2000,16,3020000016,165,1471,"YOEL GOLDMAN, JOEL LEFKOWITZ, NATHAN SCHWARCZ, NAFTALI GESTETNER, MOSHE ENGEL",679 681 CLASSON AVE LLC,12 SPENCER STREET 4 11205,7,766
307327,3046223,700 HANCOCK STREET,3,1662,34,3016620034,15,70,"SIGMUND FREUND, BLAKE GUREVITCH, SIGMUND FRUEND, ASA HAMMES, SIGMUND FREUD",STUYVESANT REALTY USA LLC,146 SPENCER STREET 5007 11205,413,21
307984,3074845,287 HARMAN STREET,3,3279,55,3032790055,65,452,"JOEL FEKETE, MOSES POLLAK, J FEKETE, M POLLAK, S BREUER",METROPOLITAN TERRACE LLC,63 FLUSHING AVENUE 299 11205,387,65
307998,3074837,303 HARMAN STREET,3,3279,47,3032790047,131,6498,"ANTHONY PAGAN, ALEXANDER SARI, TAMER KAYACAN, HEATHER PEATY, RYAN SOLARI",NEW BEDFORD MANAGEMENT,210 EAST 23RD STREET 5FLOOR 10010,0,1152
308616,3259664,53 HART STREET,3,1766,65,3017660065,23,214,"RONI ABUDI, RONI ABOUI, ARIE DAGMI, AMADOR YBANEZ, JULIE SENDER",MIGDAL MANAGEMENT 2010 LLC,249 EAST 48TH STREET 20C 10017,123,24
308739,3073195,761 HART STREET,3,3219,48,3032190048,16,95,"NANCOOAR RAJCOOAR, JHISHREE RAJCOOAR, NANCOOR RAJCOOAR, RAJENDRA RAJCOOAR",NANRAJ LP,673 MILLER AVENUE 11207,408,16
308760,3073567,792 HART STREET,3,3235,23,3032350023,3,12,"GREGORY MAIDMAN, KYLA KOHLER",RSG-SHEF 224 WEIRFIELD STREET LLC,7 PENN PLAZA 1400 10001,458,3
308795,3073235,865 HART STREET,3,3220,41,3032200041,18,376,"JERRY EDELMAN, DAVID EDELMAN, JONATHAN MORE, JONATHAN MOREL, MICHAEL DWYER",J & M REALTY SERVICES CORP,341 SAINT NICHOLAS AVENUE 1 10027,13,1581
308799,3073233,871 HART STREET,3,3220,39,3032200039,23,166,"JOEL LEFKOWITZ, ISAAC LEFKOWITZ, ALBERTO LEAL, ISAAC LEKFOWITZ, MORDECHAI JACOBOWITZ",THE MESEROLE PROJECT LLC,152 MANHATTAN AVENUE 1COM 11206,7,766
308806,3073229,883 HART STREET,3,3220,35,3032200035,10,160,"MARIEL JAVIER, EMMANUEL KU, JOSHUA KU, ALEXA FORBES",MERCY HOLDING LLC.,587 BECK STREET 10455,174,10
309459,3098666,1004 HEGEMAN AVENUE,3,4478,4,3044780004,55,751,"JONATHAN KOWITZ, JOSH KOWITZ, OSCAR KOHN, MARK KOHN, DEBBY KOHN",CSN PROPERTIES,858 BECK STREET B2 10459,263,56
309624,3096894,731 HEGEMAN AVENUE,3,4308,29,3043080029,44,556,"ALEX KOHN, ARON KAPELUSCHNIK, MATT LEVI, SOL DAY, ERDON TOPALLI",BK WEST 36TH STREET HOLDINGS LLC,1261 39TH STREET 11218,35,168
313097,3085400,509 HINSDALE STREET,3,3835,21,3038350021,149,3802,"MARTIN KIRZNER, YOSSI KIRZNER, DAVID GREENWALD, JANITZA JIMENEZ, DANIEL CALLER",FSG REALTY HOLDINGS LLC,2365 NOSTRAND AVENUE 2FLOOR 11210,17,172
313123,3085386,553 HINSDALE STREET,3,3835,1,3038350001,12,453,"BARRY HERS, USHER STEINMETZ",B. CLARK ASSOC INC,PO BOX 190335TH 11219,7,766
313702,3042499,217 THOMAS S BOYLAND STREET,3,1565,10,3015650010,28,219,"ELIE BASSALIAN, STEVEN KACHANIAN, EDWIN HURTADO, GEOVANNY VENTURA, KARINA BILGER",BLUESKY MANAGEMENT,11 MIDDLE NECK ROAD SUITE 11021,81,28
313704,3042497,221 THOMAS S BOYLAND STREET,3,1565,6,3015650006,2,14,"WAVENEY JOSEPH, IVAN NICHOLS",,311 ALBANY AVENUE 11213,421,2
313948,3082556,869 THOMAS S BOYLAND STREET,3,3612,26,3036120026,12,187,"LUDOVIK BENEDEK, ISRAEL ELBOGEN, ROBERTO LOPEZ, ROCHELLE BECK, RICHARD JORDAN",127 MESEROLE STREET CONDOMINIUM,1663 EIGHTH AVENUE 11215,363,13
313973,3082546,913 THOMAS S BOYLAND STREET,3,3612,11,3036120011,13,187,"LUDOVIK BENEDEK, ISRAEL ELBOGEN, ROCHELLE BECK, ROBERTO LOPEZ, ESTHER BACHNER",127 MESEROLE STREET CONDOMINIUM,1663 EIGHTH AVENUE 11215,363,13
314783,3041964,202 HULL STREET,3,1540,18,3015400018,2,8,"PRIYANKA KHANA, SONNY KHANA","202 HULL STREET, LLC",3377 ROBBIN LANE 11566,436,2
314784,3041728,203 HULL STREET,3,1534,38,3015340038,98,1527,"ALEX KOHN, JESSICA LEE, ARON KAPELUSCHNIK, MATT LEVI, HENRY MIZRAHI",JWASSER,1261 39TH STREET 3RD FL 11218,35,168
314898,3071661,15 HUMBOLDT STREET,3,3127,24,3031270024,4,24,"TZIPORAH AUSCH, CHAIM KLEIN",15 HUMBOLDT LLC,461 FOSTER AVENUE 1 11230,384,4
315322,3321454,177 HURON STREET,3,2523,57,3025230057,1,6,"ELIZABETH SLEVIN, EMIL SLEVIN",,1 BEACH ROAD 06811,469,1
315712,3073254,121 IRVING AVENUE,3,3221,6,3032210006,47,1633,"MICHAEL FELDMAN, ADAM LICHTENSTEIN, FATION DAUTLLARI, JUSTIN WILSON, JASON HOROWYTZ",CHOICE NY MANAGEMENT,254 WEST 31ST STREET 6FLOOR 10001,4,54
315782,3074849,211 IRVING AVENUE,3,3280,4,3032800004,1,6,UGOCHUKWU ANEKWE,ESTATE OF CECILIA ANEKWE,901 EAST PINE STREET 08332,492,1
315795,3075140,235 IRVING AVENUE,3,3290,2,3032900002,8,49,"GEORGE CHIOU, RICHARD CHIOU",GREAT HILLS REALTY CORP,7426 WOODSIDE AVENUE 1F 11373,485,8
317449,3045824,686 JEFFERSON AVENUE,3,1656,36,3016560036,1,6,CHESKY RETEK,686 JEFFERSON REALTY LLC,5301 NEW UTRECHT AVENUE 11201,444,1
317584,3039853,884 JEFFERSON AVENUE,3,1487,22,3014870022,26,209,"ELIE BASSALIAN, STEVEN KACHANIAN, EDWIN HURTADO, GEOVANNY VENTURA, ANGEL RIVERA",BLUESKY MANAGEMENT,11 MIDDLE NECK ROAD SUITE 11021,81,28
317588,3039855,890 JEFFERSON AVENUE,3,1487,24,3014870024,32,2248,"PAUL KARAQI, VICTOR MUSLIN, JON PORTELLI, ADAM FRISCHER, JACOB SIROTKIN",CENTURY MANAGEMENT,440 NINTH AVENUE 15FLOOR 10001,9,32
317673,3039903,992 JEFFERSON AVENUE,3,1488,39,3014880039,16,50,"URI MERMELSTEIN, EMMA MERKADO, JOSEPH YUSHUVAYEV, EMMA MERCADO, LATOYA ROBINSON",2611 DECATUR AVE LLC,18 EAST 48TH STREET 7FLOOR 10017,261,16
317800,3072148,305 JEFFERSON STREET,3,3166,47,3031660047,122,278,"ALBERT BASAL, FRED BASAL, ALFRED BASAL, SALVATORE D'AVOLA, FARHAD BASAL",VILLAGE PLAZA HOMES INC.,14724 HILLSIDE AVENUE 11435,13,1581
317811,3072143,315 JEFFERSON STREET,3,3166,42,3031660042,39,230,"DEODAT LOWTAN, DEODOT LOWTAN, DEODAT LOWTON, LOWTAN DEODAT, DEODAT LOWDAN",840 HART STREET LLC,238 STARR STREET 11237,439,39
320998,3054028,43 KINGSTON AVENUE,3,1871,1,3018710001,16,50,"AVRAHAM TARSHISH, MIMI BROWN, JEANETTE ABBOTT, PAMILA MAHABIR, SCOTT KUSHNICK",HOMEOWNERS SOLUTIONS GROUP LTD,914 BEDFORD AVENUE 11205,309,129
321003,3054095,45 KINGSTON AVENUE,3,1871,105,3018710105,28,292,"ALEXANDER HORN, SAM KOORIS, CURTIS STORY, ALEX HORN, SAMUEL KOORIS",INWICK PARTNERS LLC,160 BROADWAY 501 10038,239,29
321191,3072323,214 KNICKERBOCKER AVENUE,3,3174,34,3031740034,65,452,"JOEL FEKETE, MOSES POLLAK, J FEKETE, M POLLAK, S BREUER",METROPOLITAN TERRACE LLC,63 FLUSHING AVENUE 299 11205,387,65
321237,3073588,313 KNICKERBOCKER AVENUE,3,3236,8,3032360008,34,230,"ROBERT TREZZA, ERIC MANN, JEFF MANN, HANNAH LINDER, LEVI HERSHWORTIZ","L ROSE REALTY, INC",599 MANHATTAN AVENUE 11222,38,34
321330,3076122,523 KNICKERBOCKER AVENUE,3,3326,8,3033260008,27,562,"MAURICE SOHAYE, MANOOCHEHR HAIMOF, MAJID KAHEN, MAURICE SOHA, MAURICE SOHAY",LIVINGSTON I LLC,95 DELANCEY STREET 206 10002,33,71
321331,3076121,527 KNICKERBOCKER AVENUE,3,3326,6,3033260006,148,1414,"YOEL GOLDMAN, NATHAN SCHWARCZ, NAFTALI GESTETNER, MOSHE ENGEL, HECTOR PENA",679 681 CLASSON AVE LLC,12 SPENCER STREET 4 11205,7,766
321334,3076119,533 KNICKERBOCKER AVENUE,3,3326,4,3033260004,150,1424,"YOEL GOLDMAN, NATHAN SCHWARCZ, NAFTALI GESTETNER, MOSHE ENGEL, HECTOR PENA",679 681 CLASSON AVE LLC,12 SPENCER STREET 4 11205,7,766
321335,3076118,537 KNICKERBOCKER AVENUE,3,3326,2,3033260002,3,23,"MENDEL DEUTSCH, JOSEPH DEUTSCH, KENNRICK DOMINIQUE",537 KNICKERBOCKER ENTERPRISES LLC,1500 WEST BLANCKE STREET 07036,402,3
321373,3076909,657 KNICKERBOCKER AVENUE,3,3365,100,3033650100,13,47,"NICHOLAS LAROSA, FEREIDOON BEHIN, LARRY BERMAN, MATTHEW GELFAND, ANDREW BARROCAS",BIG MANAGEMENT,240 KENT AVENUE 36 11249,427,13
321433,3078890,802 KNICKERBOCKER AVENUE,3,3412,39,3034120039,86,3807,"MARK LEVINE, MARK LEVIN, JOSH SIEGEL, LIZ BAUM, MATTHEW FERRARO",EBMG LLC,501 SURF AVENUE 11224,55,86
321482,3079810,879 KNICKERBOCKER AVENUE,3,3437,9,3034370009,2,15,"GEORGINA VAZQUEZ, JENNIE VASQUEZ, JENNIE VAZQUEZ",879 KNICKERBOCKER AVENUE LLC,1317 DECATUR STREET 1 11237,498,2
322221,3049764,501 LAFAYETTE AVENUE,3,1783,98,3017830098,4,28,HERMAN JAC,LAFAYETTE PALACE LLC,503 LAFAYETTE 199 11205,453,4
323954,3081968,352 LEGION STREET,3,3581,1,3035810001,33,85,"YEHUDA ZARGAROV, UDA ZARGAROV, SAUL SHAULI",ELITE PROPERTIES NYC TEAM LLC,456 CENTRAL AVENUE 11221,339,33
324081,3116607,16 LENOX ROAD,3,5083,20,3050830020,19,210,"LIOR DISHI, RON NAHUM, AVRAHAM DISHI, AVI DISHI, MICHAEL DISHI",METROPOLITAN MANAGEMENT LLC,571 WEST 183RD STREET 10033,120,31
325709,3088705,756 LIBERTY AVENUE,3,3988,19,3039880019,39,230,"DEODAT LOWTAN, DEODOT LOWTAN, DEODAT LOWTON, LOWTAN DEODAT, DEODAT LOWDAN",840 HART STREET LLC,238 STARR STREET 11237,439,39
325949,3093975,415 LINCOLN AVENUE,3,4181,20,3041810020,12,521,"ISAAC GUTMAN, ALEXANDER HOFFMAN, JONATHAN STATFELD, EMILIO GARCIA, JULIO RAMIREZ",PARK PROPERTIES 4585-9 LLC,362 EAST KENNEDY BOULEVARD 08701,287,12
325964,3093970,435 LINCOLN AVENUE,3,4181,14,3041810014,2,9,"MOHAMMED SHAHIDULLAH, OBAED ULLAH",435 LINCOLN AVE LLC,29 MACON STREET 3C 11216,464,2
326009,3091132,54 LINCOLN AVENUE,3,4108,67,3041080067,10,45,"KEVIN WENDUM, DAVID GREENBERG, LAURENT WENDUM",RIDGEWOOD REALTY GROUP,17 WYCKOFF AVENUE 2FLOOR 11237,358,10
326299,3037094,1301 LINCOLN PLACE,3,1384,78,3013840078,13,147,"ELCORNO MARTIN, HAZEL MARTIN",473 ST JOHN REALTY CORP,792 FRANKLIN AVENUE 11238,383,13
326482,3039507,1671 LINCOLN PLACE,3,1473,51,3014730051,32,245,"ABE FIXLER, JOSH PFEIFER, PINCHES LANDAU, J. BLATTER, Y NUSSENZWEIG",STORY AVENUE HOLDINGS LLC,1369 65TH STREET BSMT 11219,252,32
326943,3035372,341 LINCOLN ROAD,3,1329,53,3013290053,87,3185,"JAMES DIMITRIADES, MICHAEL NIAMONITAKIS, JAMES D. DIMITRIADES, JAMES DEMETRIADES, STAMATIS PITTAS",MERIDIAN PROPERTIES LLC,8214 THIRD AVENUE 11209,346,87
327202,3116689,247 LINDEN BOULEVARD,3,5085,68,3050850068,74,618,"AKIVA SHOOB, MORDECHAI KOSLOWITZ, ELLIOT HOROWITZ, THEODORE FELDHEIM, THEODORE FELDHIEM",DG FLATBUSH MANAGEMENT LLC,3008 AVENUE J 11210,53,74
327241,3098623,2775 LINDEN BOULEVARD,3,4469,17,3044690017,1,48,"SANDRA PITTERSON, VICTOR ORRIOLA",BROOKLYN UNITED METHODIST CHURCH HOME,806 DREW STREET 11208,516,1
327376,3116710,50 LINDEN BOULEVARD,3,5086,32,3050860032,111,2081,"JOHN WARREN, JOHN CROTTY, DENNIS TAYLOR, ELSIE ORTIZ, LUIS RAMOS",MHR MANAGEMENT INC,4355 11TH STREET 11101,13,1581
327388,3116711,54 LINDEN BOULEVARD,3,5086,34,3050860034,111,2081,"JOHN WARREN, JOHN CROTTY, DENNIS TAYLOR, ELSIE ORTIZ, LUIS RAMOS",MHR MANAGEMENT INC,4355 11TH STREET 11101,13,1581
327539,3102242,820 LINDEN BOULEVARD,3,4679,1,3046790001,49,785,"ISAAC SCHWARTZ, MENDY LOWY, YOEL SCHWARTZ, SHLOMO LOWY, SHIA ROSENBAUM",PACIFIC MANAGEMENT,744 CONEY ISLAND AVENUE 11218,302,50
327700,3076219,30 LINDEN STREET,3,3330,11,3033300011,16,50,"TAL SHLOMI, ELIAS BENNAIM, NETA SHLOMI, ANTHONY JULIEN, ELYSAF BENNAIM",EVERTON MANAGEMENT LLC,163 KINGSTON AVENUE 11213,411,16
327787,3076261,98 LINDEN STREET,3,3332,8,3033320008,4,24,"TZIPORAH AUSCH, CHAIM KLEIN",15 HUMBOLDT LLC,461 FOSTER AVENUE 1 11230,384,4
327955,3089549,544 LINWOOD STREET,3,4034,27,3040340027,26,78,"BENIAMIN SADYKOV, ROBERT MATATOV, MARCUS DREHER, MARK ISAKOV, BEN SADYKOV",RBM NY HOLDINGS LLC,9906 METROPOLITAN AVENUE 2 11375,284,27
328166,3081941,235 LIVONIA AVENUE,3,3575,1,3035750001,24,330,"SIMEON FARBER, ZEV SALOMON, URI DREIFUS, TASO VASSILOU, SAM FARBER",ROCKAWAY MAINTENANCE PARTNERS CORP,207 ROCKAWAY TURNPIKE 11559,241,32
328318,3071760,15 LOCUST STREET,3,3134,42,3031340042,60,734,"JOSH SHINE, SHIMON LEITER, DOVY ANDRUSIER, BORUCH OKUNOV, LEIB SKOBLO",THE SHINE CORP,781 EAST NEW YORK AVENUE 3 11203,71,89
328321,3071769,18 LOCUST STREET,3,3135,13,3031350013,2,12,"ZOROASTRO MONTES DE OCA, ADOLFO JUAREZ",,18 LOCUST STREET 11206,476,2
328555,3095633,584 LOGAN STREET,3,4262,37,3042620037,9,60,"ABRAHAM GRUNBAUM, ABE GRUNBAUM, J SHARMA, EMERIC WEINSTOCK, ABRAHA GRUNBAUM",NOSTRAND HOLDING LLC,143 TAYLOR STREET 11211,412,10
329132,3082475,41 LOTT AVENUE,3,3610,9,3036100009,10,193,"JOSEPH GREENFIELD, CIPORAH GREENFIELD, SYLVIA GREEN, SYLVIA GREENFIELD, CIPPORAH GREENFIELD",RELIABLE REALTY & MANAGEMENT LLC,1717 52ND STREET 11204,416,10
329974,3046384,401 MACON STREET,3,1664,57,3016640057,6,104,"MARK NUSSBAUM, TANYA CRAIG, JESUS AYALA, BRYAN KURTZ, ANTHONY CUCURULLO",USA QUICK SOLUTION,1596 PACIFIC STREET 11213,397,6
330689,3076903,1385 MADISON STREET,3,3363,29,3033630029,24,129,"OREN NOY, ELI NOY, ABE NOY, ERAN NOY","DAFNA HOMES, LLC",126 LOMBARDY STREET 11222,46,24
330967,3051792,456 MADISON STREET,3,1826,25,3018260025,53,521,"JOSEPH LICHTMAN, YOSSEL LICHTMAN, JACK ZIMMER, JACOB ZIMMER, STEVE LICHTMAN",ROGERS MANAGEMENT LLC,311 ROGERS AVENUE 11225,396,54
331233,3045322,788 MADISON STREET,3,1648,14,3016480014,29,313,"ALEXANDER HORN, SAM KOORIS, CURTIS STORY, ALEX HORN, SAMUEL KOORIS",INWICK PARTNERS LLC,160 BROADWAY 501 10038,239,29
331569,3069581,230 MANHATTAN AVENUE,3,2788,5,3027880005,2,11,"ELIMELECH LEIFER, SAMSON TIRNAVER, ISAAC DAHAN",230 MANHATTAN AVE LLC,338 MARCY AVENUE 11211,466,2
332331,3106816,590 MAPLE STREET,3,4799,24,3047990024,3,10,"GLYNE HURLEY, MARJORIE HURLEY, KIARJORIE HURLEY, PIERRE HURLEY, ANNETTE HURLEY",,32 JOAN COURT 11003,398,3
332612,3048777,602 MARCY AVENUE,3,1758,54,3017580054,15,117,"SAM WEINBERG, JOHN BHAWANDAT, JOHN BHWADAT, JOHN BHWANDAT, JOHN BARTHOLOME",CLINTON HILL HOMES LP,543 BEDFORD AVENUE 295 11211,437,15
