42892,1062834,522 WEST 161 STREET,1,2119,26,1021190026,7,187,"ADAM VERNER, AVI SINGER, MARCO DEUTELMOSER",SPRINGHOUSE MANAGEMENT LLC,320 FIFTH AVENUE 1115 10001,118,7
42918,1062824,574 WEST 161 STREET,1,2119,12,1021190012,46,1495,"LEWIS BARBANEL, ROBERT SILVERMAN, ASTI ROSARIO, PANOS PAPADONIOU, LEWIS BARBANAL",BARBERRY ROSE MANAGEMENT CO. INC.,1024 BROADWAY 11598,20,48
42969,1062919,535 WEST 162 STREET,1,2122,15,1021220015,32,1322,"CARL ZEKARIA, ALAN SHAMAH, CARL ZEKERIA",SHAMCO MANAGEMENT CORP,1901 DORCHESTER ROAD B2 11226,227,32
42972,1062921,543 WEST 162 STREET,1,2122,21,1021220021,69,2198,"JONATHAN SAMET, MARVIN BASCH, SAM BROWN, ANDREW ARFE, BERNY RODRIGUEZ",US REALTY CORP,1360 EAST 14TH STREET 101 11230,133,71
43016,1063364,610 WEST 163 STREET,1,2137,86,1021370086,30,998,"SHAUL KOPLOWITZ, DOV SHREBER, DOV SHREBBER, BIONDYS DURAN, FRANCISCO DIAZ",AMSTERDAM 1883-1887 LLC,1 HILLCREST CENTER DRIVE 230 10977,194,30
43035,1062933,545 WEST 164 STREET,1,2122,88,1021220088,78,1812,"BORUCH HERSH, JOSHUA GOTLIB, REYNALDO LESLIE, PHIL FROOM, MONTAUK HOUSING LLC",NIEUW AMSTERDAM PROPERTY MANAGEMENT,243 FIFTH AVENUE 409 10016,23,99
43036,1062936,548 WEST 164 STREET,1,2122,110,1021220110,46,1495,"LEWIS BARBANEL, ROBERT SILVERMAN, ASTI ROSARIO, PANOS PAPADONIOU, LEWIS BARBANAL",BARBERRY ROSE MANAGEMENT CO. INC.,1024 BROADWAY 11598,20,48
43109,1063032,503 WEST 169 STREET,1,2126,48,1021260048,36,1012,"MORRIS ARLOS, TANNER TEW, DOUGLAS PETERSON, MYNOR OSORIO, PABLO SAQUICUYA",CITY SKYLINE REALTY INC,507 WEST 139TH STREET A 10031,205,36
43116,1063001,514 WEST 169 STREET,1,2125,36,1021250036,71,1158,"JOHN CATALIC, ENIS CECUNJANIN, MICHAEL BESEN, RIKIN SHETH, GJON CATALIC",NEW YORK CITY MANAGEMENT,381 PARK AVENUE SOUTH 1515 10016,1,90
43118,1063000,516 WEST 169 STREET,1,2125,34,1021250034,29,1008,"ALBERT ABRAHAM, MIKE SPIRA, JAY JAFFE, STEVE SPERA, RAPHAEL KOHANTEB",ST NICHOLAS 24 LLC,27 AUDUBON AVENUE BSMT 10032,175,29
43215,1063103,506 WEST 173 STREET,1,2129,41,1021290041,90,1210,"JOSEPH SOLEIMANI, JULIO CHABLA, JOE SOLEIMANI, JOSE TORRES, JOSEPH SOLEIMANO","ABJ CHOSEN, LLC.",1652 PARK AVENUE LL 10035,172,90
43225,1063102,524 WEST 173 STREET,1,2129,40,1021290040,90,1210,"JOSEPH SOLEIMANI, JULIO CHABLA, JOE SOLEIMANI, JOSE TORRES, JOSEPH SOLEIMANO","ABJ CHOSEN, LLC.",1652 PARK AVENUE LL 10035,172,90
43246,1063498,650 WEST 173 STREET,1,2142,115,1021420115,29,1591,"FLORENCE EDELSTEIN, MICHAEL EDELSTEIN, TANYA GOLDMAN, DANIEL EDELSTEIN, TANYA BREYTER",EDEL FAMILY MANAGEMENT CORP,2207 CONEY ISLAND AVENUE 11223,130,29
43265,1063523,610 WEST 174 STREET,1,2143,9,1021430009,78,1812,"BORUCH HERSH, JOSHUA GOTLIB, REYNALDO LESLIE, PHIL FROOM, MONTAUK HOUSING LLC",NIEUW AMSTERDAM PROPERTY MANAGEMENT,243 FIFTH AVENUE 409 10016,23,99
43335,1063185,534 WEST 178 STREET,1,2132,29,1021320029,135,6806,"EFSTATHIOS VALIOTIS, NICK CONWAY, SOCRATES FORADOULAS, NICHOLAS CONWAY, GEORGE SAKELLARIS",ALMA REALTY CORP,3110 37TH AVENUE 500 11101,131,135
43338,1063549,604 WEST 178 STREET,1,2144,40,1021440040,428,50838,"DONNA WEINBERG, MARIO FIGUEROA, ONEEKA WILLIAMS, ANGELO BRUNO, RANDY SULZER","FIRSTSERVICE RESIDENTIAL NEW YORK, INC.",622 THIRD AVENUE 14FLOOR 10017,0,1152
43371,1063599,508 WEST 180 STREET,1,2152,41,1021520041,6,81,"DAVID YAMINIAN, SUSAN YAMINIAN, AMIR SEDAGHAT",WESTCHESTER SQUARE PLAZA REALTY LLC,2482 GRAND CONCOURSE 10458,229,6
43372,1063598,512 WEST 180 STREET,1,2152,39,1021520039,15,363,"DAVID GALABYA, LUCIEN ZITO, JONAH BAMBERGER",146TH APARTMENTS LLC,40 BROAD STREET 605 10004,219,15
43386,1064285,711 WEST 180 STREET,1,2176,149,1021760149,46,1495,"LEWIS BARBANEL, ROBERT SILVERMAN, ASTI ROSARIO, PANOS PAPADONIOU, LEWIS BARBANAL",BARBERRY ROSE MANAGEMENT CO. INC.,1024 BROADWAY 11598,20,48
43387,1064266,712 WEST 180 STREET,1,2176,42,1021760042,36,1012,"MORRIS ARLOS, TANNER TEW, DOUGLAS PETERSON, MYNOR OSORIO, PABLO SAQUICUYA",CITY SKYLINE REALTY INC,507 WEST 139TH STREET A 10031,205,36
43402,1079910,554 WEST 181 STREET,1,2153,68,1021530068,23,1513,"CARMELO MILIO, GIOVANNI PUERTA, JEANETTE WILSON, HENRY GARDEN, SUZETTE BURGESS",TRION REAL ESTATE MANAGEMENT,165 WEST 127TH STREET 101 10027,137,23
43403,1063637,558 WEST 181 STREET,1,2153,67,1021530067,23,1513,"CARMELO MILIO, GIOVANNI PUERTA, JEANETTE WILSON, HENRY GARDEN, SUZETTE BURGESS",TRION REAL ESTATE MANAGEMENT,165 WEST 127TH STREET 101 10027,137,23
43404,1063649,561 WEST 181 STREET,1,2154,24,1021540024,23,1513,"CARMELO MILIO, GIOVANNI PUERTA, JEANETTE WILSON, HENRY GARDEN, SUZETTE BURGESS",TRION REAL ESTATE MANAGEMENT,165 WEST 127TH STREET 101 10027,137,23
43442,1063951,605 WEST 182 STREET,1,2165,45,1021650045,2,40,"CONSTANTINA KATECHIS, CONSTANTINA KALECHIS","KALABRITA, LLC",605 WEST 182ND STREET 10033,237,2
43509,1063987,649 WEST 184 STREET,1,2167,27,1021670027,42,972,"ELEANOR PATRICK, MEILECH WEISS, ARI NOE, JOEL BASCH, SHLOME REIFER",873-879 LLC,3611 14TH AVENUE 603 11218,112,44
43639,1063886,560 WEST 192 STREET,1,2161,114,1021610114,74,618,"AKIVA SHOOB, MORDECHAI KOSLOWITZ, ELLIOT HOROWITZ, THEODORE FELDHEIM, THEODORE FELDHIEM",DG FLATBUSH MANAGEMENT LLC,3008 AVENUE J 11210,53,74
43642,1063884,569 WEST 192 STREET,1,2161,103,1021610103,74,618,"AKIVA SHOOB, MORDECHAI KOSLOWITZ, ELLIOT HOROWITZ, THEODORE FELDHEIM, THEODORE FELDHIEM",DG FLATBUSH MANAGEMENT LLC,3008 AVENUE J 11210,53,74
43644,1063873,558 WEST 193 STREET,1,2161,49,1021610049,42,972,"ELEANOR PATRICK, MEILECH WEISS, ARI NOE, JOEL BASCH, SHLOME REIFER",873-879 LLC,3611 14TH AVENUE 603 11218,112,44
43645,1063872,562 WEST 193 STREET,1,2161,45,1021610045,16,847,"JOSEPH PODOLSKI, WARREN LEVIE, JAIME SMITH, ISRAEL KAPLAN, JUAN REYES",318 REALTY CO,3153 PERRY AVENUE 10467,246,16
43665,1064727,520 WEST 204 STREET,1,2218,17,1022180017,73,4814,"PETER REBENWURZEL, MICHAEL HAAS, YOSSI GOLDBERG, EZRA BETECH, EPHRAIM NIERENBERG","159 BAY REALTY, LLC",1499 CONEY ISLAND AVENUE 11230,34,137
43706,1064997,623 WEST 207 STREET,1,2242,65,1022420065,146,11137,"DONALD HASTINGS, MAGGIE MCCORMICK, DONALD HASTING, BRIAN GARLAND, DOUGLAS EISENBERG","KEW GARDENS HILLS, LLC",1065 AVENUE OF THE AMERICAS 31FLOOR 10018,79,146
43708,1064998,631 WEST 207 STREET,1,2242,67,1022420067,146,11137,"DONALD HASTINGS, MAGGIE MCCORMICK, DONALD HASTING, BRIAN GARLAND, DOUGLAS EISENBERG","KEW GARDENS HILLS, LLC",1065 AVENUE OF THE AMERICAS 31FLOOR 10018,79,146
43721,1064881,509 WEST 212 STREET,1,2230,27,1022300027,29,1008,"ALBERT ABRAHAM, MIKE SPIRA, JAY JAFFE, STEVE SPERA, RAPHAEL KOHANTEB",ST NICHOLAS 24 LLC,27 AUDUBON AVENUE BSMT 10032,175,29
44022,1033802,471 WEST END AVENUE,1,1245,24,1012450024,3,19,"RODERICK HICKEY III, NANCY HICKEY, ROD HICKEY, ROD HICKEY III, ROD HICKEY.III","313 WEST 90TH ST, LLC",231 WEST 29TH STREET 504 10001,155,3
45435,2003173,1180 ANDERSON AVENUE,2,2510,69,2025100069,14,328,"VICENTE CERVANTES, LUIS FERMIN, JEFFREY FREEDMAN, JIMMY LONDONO, RAMIRO HERNANDEZ",BRIDGESTONE GROUP LLC,1530 MCDONALD AVENUE D 11230,278,14
45454,2003048,974 ANDERSON AVENUE,2,2504,72,2025040072,55,1653,"MICHAEL ARYEH, BRIAN NEWMAN, ISAAC ARYEH, RYAN ZAR, AARON MECHLOVICS",VIP 1 PARTNERS LLC,825 EIGHTH AVENUE 18N 10019,24,445
45485,2014738,2290 ANDREWS AVENUE NORTH,2,3218,17,2032180017,70,2284,"JACOB EISENSTEIN, HARRY EISENSTEIN, ISRAEL COHEN, MARK EISENSTEIN, ISAAC EISENSTEIN",DAVID EISENSTEIN REAL ESTATE,244 WEST 54TH STREET 702 10019,5,105
45567,2014897,1905 ANDREWS AVENUE SOUTH,2,3221,90,2032210090,25,358,"ABDUL KHAN, CHARITY CINTRON, LUTFA KHAN, SHIBBER KHAN, ABDUL KAHN",NONE,2250 GRAND CONCOURSE 10457,160,25
45627,2007581,1842 ANTHONY AVENUE,2,2803,3,2028030003,0,,,,,292,1
45700,2013703,2160 ANTHONY AVENUE,2,3157,1,2031570001,101,2698,"PESACH MILLER, MOSHE STAHL, GEORGE ZAYAS, ARI EDELL, HARRY GARTNER",EAST 117TH REALTY LLC,102 EAST 116TH STREET ST1 10029,173,108
45747,2014668,2547 AQUEDUCT AVENUE WEST,2,3214,86,2032140086,104,3230,"RICK HERMAN, ANTON POPOVIC, MAURICE MCKENZIE, LOUIS POPOVIC, JORGE GUARACA",JLP METRO MANAGEMENT INC.,3397 EAST TREMONT AVENUE 10461,50,127
46172,2012027,2110 ARTHUR AVENUE,2,3070,5,2030700005,15,272,"JASON GREEN, HEATHER GLASSBERG, LAWRENCE ZOMBEK, MICHAEL CHOOKASEZIAN, LUIS MARTINEZ",523 WEST 157TH LLC,319 EAST 91ST STREET PROFS 10128,165,15
46642,2016801,2601 BAINBRIDGE AVENUE,2,3293,58,2032930058,92,3107,"RICK HERMAN, MAURICE MCKENZIE, ANTON POPOVIC, EDWARD OSTAD, JORGE GUARACA",PARK AVE SOUTH MGMT,560 WEST 180TH STREET 306 10033,50,127
46644,2016800,2605 BAINBRIDGE AVENUE,2,3293,56,2032930056,92,3107,"RICK HERMAN, MAURICE MCKENZIE, ANTON POPOVIC, EDWARD OSTAD, JORGE GUARACA",PARK AVE SOUTH MGMT,560 WEST 180TH STREET 306 10033,50,127
46645,2016799,2609 BAINBRIDGE AVENUE,2,3293,54,2032930054,92,3107,"RICK HERMAN, MAURICE MCKENZIE, ANTON POPOVIC, EDWARD OSTAD, JORGE GUARACA",PARK AVE SOUTH MGMT,560 WEST 180TH STREET 306 10033,50,127
46817,2017812,3525 BAINBRIDGE AVENUE,2,3328,117,2033280117,4,120,"ADI JOSEPH, WILFREDO LORA, BENJAMIN RIVERA",BAINBRIDGE GATE II LLC,1301 CORNAGA AVENUE C 11691,299,4
50311,2001993,289 BONNER PLACE,2,2423,16,2024230016,8,68,"ABRAHAM SAMUEL, MIKE SMITH, JOHN SCOTT, MORDECHAI LICHTENSTADTER, LOUIS MOJICO",289 LLC,1200 51ST STREET 190311 11219,255,8
50699,2016300,2985 BOTANICAL SQUARE,2,3274,21,2032740021,78,5279,"LABE TWERSKI, MOSHE HALBERSTAM, ELI SINGER, IABE TWERSKI, SAM BECKER",RESIDENTIAL MANAGEMENT (NY) INC,1651 CONEY ISLAND AVENUE 4 11230,136,100
50700,2016301,2995 BOTANICAL SQUARE,2,3274,27,2032740027,78,5279,"LABE TWERSKI, MOSHE HALBERSTAM, ELI SINGER, IABE TWERSKI, SAM BECKER",RESIDENTIAL MANAGEMENT (NY) INC,1651 CONEY ISLAND AVENUE 4 11230,136,100
51035,2023870,1135 BOYNTON AVENUE,2,3740,55,2037400055,3,91,"DAVID SEDGH, JACOB SEDGH, ABRAHAM SEDGH, ISAAC SIDAOUI, JUAN VALAREZO",D&J MANAGEMENT III LLC,4013 104TH 11368,336,3
51241,2016796,2616 BRIGGS AVENUE,2,3293,47,2032930047,22,733,"ANGEL ORTIZ, JULIO HERNANDEZ, CIREL LANDAU, MIKLOS VASARHELYI, MARINA VASARHELYI",79 S N LTD,2562 BRIGGS AVENUE 10458,217,22
51345,2016911,2886 BRIGGS AVENUE,2,3296,27,2032960027,10,281,"GINA COTAJ, FRANK COTAJ, NIKOLL COTAJ, FRAN COTAJ, MARTIN COTAJ",NVN REALTY LLC,254 EAST 202ND STREET L2 10458,158,10
52725,2000107,506 BROOK AVENUE,2,2274,6,2022740006,1,9,"MARIO OLIVERO, SONIA OLIVERO",PATH OF BLESSINGS,506 BROOK AVENUE 10454,251,1
53837,2014533,51 BUCHANAN PLACE,2,3208,48,2032080048,67,2223,"JACOB EISENSTEIN, HARRY EISENSTEIN, JOSEPH TEICHMAN, MARK EISENSTEIN, ISAAC EISENSTEIN",DAVID EISENSTEIN REAL ESTATE,244 WEST 54TH STREET 702 10019,5,105
55100,2057563,3800 CARPENTER AVENUE,2,4654,1,2046540001,5,149,"CHICO GIBBONS, CHARLES WINSTON, ARTHUR GIBBONS, CHARLIE WINSTON, STEVE WHITE",GIBBONS MANAGEMENT CORP,229 WEST 111TH STREET 5 10026,209,5
55431,2002824,1011 CARROLL PLACE,2,2461,111,2024610111,62,2211,"JACOB EISENSTEIN, HARRY EISENSTEIN, MARK EISENSTEIN, ISAAC EISENSTEIN, LAURA BOUCAI",DAVID EISENSTEIN REAL ESTATE,244 WEST 54TH STREET 702 10019,5,105
55433,2002726,1050 CARROLL PLACE,2,2456,1,2024560001,72,3741,"YECHIEL WEINBERGER, MARGARETA MILLER, YECHIEL WEINBEGER, ERIC MILLER, YECHEIL WEINBERGER",TROY INDUSTRIES LLC,4711 12TH AVENUE A8 11219,272,72
55438,2002727,1064 CARROLL PLACE,2,2456,8,2024560008,72,3741,"YECHIEL WEINBERGER, MARGARETA MILLER, YECHIEL WEINBEGER, ERIC MILLER, YECHEIL WEINBERGER",TROY INDUSTRIES LLC,4711 12TH AVENUE A8 11219,272,72
56815,2091238,1145 CLAY AVENUE,2,2429,19,2024290019,38,1189,"ISMAEL AYALA, AARON AUSCH, VICTOR RUIZ, ZULAY MATEO, JORGE RUIZ",3343-3345 DECATUR GROUP LLC,11 AVENUE F 3FLOOR 11218,250,53
56823,2002077,1182 CLAY AVENUE,2,2426,54,2024260054,12,220,"TIMOUR SHAFRAN, STEVE SATZ, SERKAN ERSIZ, TIMOUR SHAFRON, STEVEN SATZ",CITICORE LLC,11 WEST 36TH STREET 4FLOOR 10018,254,12
56827,2002079,1190 CLAY AVENUE,2,2426,56,2024260056,56,763,"JONATHAN KOWITZ, JOSH KOWITZ, OSCAR KOHN, MARK KOHN, DEBBY KOHN",CSN PROPERTIES,858 BECK STREET B2 10459,263,56
56833,2002083,1208 CLAY AVENUE,2,2426,60,2024260060,2,15,"LEO HERNANDEZ, CND940 HERNANDEZ, AURA HERNANDEZ",LRH CLAY MGMT INC,38 AVON PLACE 2 10301,264,2
56849,2002102,1276 CLAY AVENUE,2,2427,21,2024270021,27,720,"ZEV MILTZ, DOV RAKOWER, DOU RAKOWER, DAVID RAKOWER, NATALIYA DYAKOVSKAYA",1260-1276 CLAY AVE LLC,1780 GRAND CONCOURSE 35 10457,150,27
56950,2009327,1686 CLAY AVENUE,2,2889,5,2028890005,10,139,"CHAYA WEISS, BARRY WEISS, OSMIN VARGAS, DARWIN GARCIA, LAZAR WEISS",104 W REALTY LLC.,1690 CLAY AVENUE 10457,247,10
57754,2002252,1110 COLLEGE AVENUE,2,2434,4,2024340004,12,220,"TIMOUR SHAFRAN, STEVE SATZ, SERKAN ERSIZ, TIMOUR SHAFRON, STEVEN SATZ",CITICORE LLC,11 WEST 36TH STREET 4FLOOR 10018,254,12
57762,2002258,1142 COLLEGE AVENUE,2,2434,15,2024340015,61,1729,"WILFREDO CUASCUT, JAC ZADRIMA, WILLIAM FERNANDEZ, ATHAS IOANNOU, MARIA IOANNOU",GENESIS REALTY GROUP LLC,4419 THIRD AVENUE 4A 10457,204,63
57815,2007287,1311 COLLEGE AVENUE,2,2785,67,2027850067,16,290,"BOZHENA BASMANOV, ANTHONY ORTEGA, JON BASMANOV, BOZHENA BASMANOR, MARJORIE VOZZA",181 WEST 135TH STREET LLC,817 WESTCHESTER AVENUE 10455,202,16
58004,2024603,1205 COMMONWEALTH AVENUE,2,3761,1,2037610001,20,210,"LIOR DISHI, RON NAHUM, AVI DISHI, AVRAHAM DISHI, MICHAEL DISHI",METROPOLITAN MANAGEMENT LLC,571 WEST 183RD STREET 10033,120,31
58161,2028531,1547 COMMONWEALTH AVENUE,2,3917,28,2039170028,71,196,"MANSOUR MEHDIZADEH, TONY ZADEH, DAVID DILMANIAN, AREF SHAHIPOUR, MANSOUR MEHDZIADEH",BROOKVILLE HOMES LLC,14720 HILLSIDE AVENUE 11435,126,72
59154,2007669,2043 CRESTON AVENUE,2,2807,59,2028070059,10,496,"DAVID GUNSBERG, DAVID GINSBERG, ARON GUNSBERG, DAVID GUNSBURG, JEFFREY ADAMES",KINGSBRIDGE COURT APTS LLC,1744 EAST THIRD STREET 1FLOOR 11223,268,10
59160,2013741,2076 CRESTON AVENUE,2,3160,14,2031600014,14,328,"VICENTE CERVANTES, LUIS FERMIN, JEFFREY FREEDMAN, JIMMY LONDONO, RAMIRO HERNANDEZ",BRIDGESTONE GROUP LLC,1530 MCDONALD AVENUE D 11230,278,14
59162,2013745,2084 CRESTON AVENUE,2,3161,1,2031610001,13,583,"JOHN LAROCCA, JOSEPH LAROCCA, RAUL DE LA ROSA, JOSE CABRERA, 757 EMPIRE REALTY INC",REALM REALTY MANAGEMENT LLC,944 42ND STREET A1 11219,320,13
59165,2013842,2095 CRESTON AVENUE,2,3169,43,2031690043,13,583,"JOHN LAROCCA, JOSEPH LAROCCA, RAUL DE LA ROSA, JOSE CABRERA, 757 EMPIRE REALTY INC",REALM REALTY MANAGEMENT LLC,944 42ND STREET A1 11219,320,13
59169,2013753,2150 CRESTON AVENUE,2,3162,1,2031620001,92,3107,"RICK HERMAN, MAURICE MCKENZIE, ANTON POPOVIC, EDWARD OSTAD, JORGE GUARACA",PARK AVE SOUTH MGMT,560 WEST 180TH STREET 306 10033,50,127
59183,2013875,2255 CRESTON AVENUE,2,3171,34,2031710034,38,1189,"ISMAEL AYALA, AARON AUSCH, VICTOR RUIZ, ZULAY MATEO, JORGE RUIZ",3343-3345 DECATUR GROUP LLC,11 AVENUE F 3FLOOR 11218,250,53
59194,2013773,2298 CRESTON AVENUE,2,3164,1,2031640001,39,703,"ISSAKA MAIGUZO, DENNIS RIVERA, RAMIN RODFAR, GABRIEL GARCIA, ILLIAS BALLENILA",1970 UNIVERSITY LLC,36 WEST 37TH STREET 10018,0,1152
59195,2013896,2301 CRESTON AVENUE,2,3172,40,2031720040,135,6206,"BEN RIEDER, JONATHAN WIENER, JORGE LOVERA, CHRISTIAN MALOTA, RICK MARTINEZ","CHESTNUT HOLDINGS OF NEW YORK, INC",5676 RIVERDALE AVENUE 307 10471,128,135
59204,2013776,2320 CRESTON AVENUE,2,3164,11,2031640011,8,324,"ALEX GAZIVODA, LEZE GAZIVODA, RUDOLF TORRES, RUDY CABRERA, MIKE RIVERA",APG REALTY CORP,4419 THIRD AVENUE 4C 10457,295,8
59206,2013777,2332 CRESTON AVENUE,2,3164,15,2031640015,37,1707,"MARTIN MEYER, ERIC SAMSON, AL LAZAR, MANNY STEIN, USHER ANSHUL",ROCHPARK LLC,1215 EASTERN PARKWAY 1B 11213,28,50
59218,2013792,2390 CRESTON AVENUE,2,3165,11,2031650011,2,61,"SAM JACOBS, GREGORIO REYES, ERNESTO AZUARA",YSM MANAGEMENT LLC,100 A BROADWAY 449 11249,321,2
59235,2013815,2538 CRESTON AVENUE,2,3167,32,2031670032,14,181,"ROBERT CASALASPRO, DAVID LEVITAN, YOSEF RABINOWITZ, NATHAN SILVERMAN, CHARISSE GARRETT",SAMARITAN DAYTOP VILLAGE,13802 QUEENS BOULEVARD 11435,156,14
59245,2013829,2608 CRESTON AVENUE,2,3168,16,2031680016,21,2312,"EVA NUCCI, ERICA ALAYON, ANDREW SCHWARTZ, LISANDRA NIKQI, MOLLY SHIFRIN",QC DECATUR LLC,3480 SEYMOUR AVENUE 10469,63,21
59247,2017483,2675 CRESTON AVENUE,2,3316,57,2033160057,69,4482,"VED PARKASH, JAINE PEREZ, ANTON ANTHONY, JULIO VILLARS",PARKASH 242 LLC,17214 89TH AVENUE 11432,273,69
59321,2017576,2850 CRESTON AVENUE,2,3319,8,2033190008,38,1189,"ISMAEL AYALA, AARON AUSCH, VICTOR RUIZ, ZULAY MATEO, JORGE RUIZ",3343-3345 DECATUR GROUP LLC,11 AVENUE F 3FLOOR 11218,250,53
59487,2003023,1160 CROMWELL AVENUE,2,2496,34,2024960034,75,4281,"RICHARD TIMBERGER, ROGER TATE, STEVEN FINKELSTEIN, STEVE FINKELSTEIN, BOB PARADISE",CHARLOTTE BAILEY LLC,3041 HOLLAND AVENUE 56C 10467,270,75
60012,2009890,657 CROTONA PARK NORTH,2,2944,5,2029440005,50,800,"ISAAC SCHWARTZ, MENDY LOWY, YOEL SCHWARTZ, SHLOMO LOWY, SHIA ROSENBAUM",PACIFIC MANAGEMENT,744 CONEY ISLAND AVENUE 11218,302,50
60503,2014256,2353 DAVIDSON AVENUE,2,3198,34,2031980034,18,100,"YISROEL BORNSTEIN, YITZCHOK BLUM, Y BORNSTEIN, MENDEL TESSLER, M TESSLER",AWALY LLC,4415 13TH AVENUE 11219,282,18
60517,2014320,2390 DAVIDSON AVENUE,2,3199,59,2031990059,135,6206,"BEN RIEDER, JONATHAN WIENER, JORGE LOVERA, CHRISTIAN MALOTA, RICK MARTINEZ","CHESTNUT HOLDINGS OF NEW YORK, INC",5676 RIVERDALE AVENUE 307 10471,128,135
60520,2014312,2401 DAVIDSON AVENUE,2,3199,38,2031990038,61,2207,"JACOB EISENSTEIN, HARRY EISENSTEIN, MARK EISENSTEIN, ISAAC EISENSTEIN, LAURA BOUCAI",DAVID EISENSTEIN REAL ESTATE,244 WEST 54TH STREET 702 10019,5,105
60524,2014323,2420 DAVIDSON AVENUE,2,3199,72,2031990072,135,6206,"BEN RIEDER, JONATHAN WIENER, JORGE LOVERA, CHRISTIAN MALOTA, RICK MARTINEZ","CHESTNUT HOLDINGS OF NEW YORK, INC",5676 RIVERDALE AVENUE 307 10471,128,135
60791,2016325,2543 DECATUR AVENUE,2,3275,55,2032750055,21,2312,"EVA NUCCI, ERICA ALAYON, ANDREW SCHWARTZ, LISANDRA NIKQI, MOLLY SHIFRIN",QC DECATUR LLC,3480 SEYMOUR AVENUE 10469,63,21
60792,2016324,2549 DECATUR AVENUE,2,3275,51,2032750051,19,1920,"EVA NUCCI, ERICA ALAYON, LISANDRA NIKQI, ANDREW SCHWARTZ",QC DECATUR LLC,3480 SEYMOUR AVENUE 10469,63,21
60793,2016323,2553 DECATUR AVENUE,2,3275,50,2032750050,21,2312,"EVA NUCCI, ERICA ALAYON, ANDREW SCHWARTZ, LISANDRA NIKQI, MOLLY SHIFRIN",QC DECATUR LLC,3480 SEYMOUR AVENUE 10469,63,21
60794,2016322,2559 DECATUR AVENUE,2,3275,49,2032750049,21,2312,"EVA NUCCI, ERICA ALAYON, ANDREW SCHWARTZ, LISANDRA NIKQI, MOLLY SHIFRIN",QC DECATUR LLC,3480 SEYMOUR AVENUE 10469,63,21
60796,2016321,2563 DECATUR AVENUE,2,3275,48,2032750048,21,2312,"EVA NUCCI, ERICA ALAYON, ANDREW SCHWARTZ, LISANDRA NIKQI, MOLLY SHIFRIN",QC DECATUR LLC,3480 SEYMOUR AVENUE 10469,63,21
60797,2016320,2567 DECATUR AVENUE,2,3275,46,2032750046,21,2312,"EVA NUCCI, ERICA ALAYON, ANDREW SCHWARTZ, LISANDRA NIKQI, MOLLY SHIFRIN",QC DECATUR LLC,3480 SEYMOUR AVENUE 10469,63,21
60799,2016335,2600 DECATUR AVENUE,2,3276,4,2032760004,55,1653,"MICHAEL ARYEH, BRIAN NEWMAN, ISAAC ARYEH, RYAN ZAR, AARON MECHLOVICS",VIP 1 PARTNERS LLC,825 EIGHTH AVENUE 18N 10019,24,445
60822,2016480,2679 DECATUR AVENUE,2,3282,42,2032820042,5,132,"ARI LOWY, MANNY HIJOSA, MANNY HINOJOSA, NICHOLAS FLAZ, JOSE ACOSTA",SHERIDAN MANAGEMENT,129 NORTH COUNTY LINE ROAD 148 08527,271,5
60837,2016379,2726 DECATUR AVENUE,2,3278,18,2032780018,37,1569,"SHIMON GREISMAN, BORUCH GREISMAN, DAVID GOLD, ABRAHAM GREISMAN, GARY GARTENBERG",SKYC MANAGEMENT,1419 60TH STREET 11219,77,71
60839,2016380,2730 DECATUR AVENUE,2,3278,22,2032780022,37,1569,"SHIMON GREISMAN, BORUCH GREISMAN, DAVID GOLD, ABRAHAM GREISMAN, GARY GARTENBERG",SKYC MANAGEMENT,1419 60TH STREET 11219,77,71
60865,2016560,2833 DECATUR AVENUE,2,3284,39,2032840039,23,1513,"CARMELO MILIO, GIOVANNI PUERTA, JEANETTE WILSON, HENRY GARDEN, SUZETTE BURGESS",TRION REAL ESTATE MANAGEMENT,165 WEST 127TH STREET 101 10027,137,23
61011,2018514,3335 DECATUR AVENUE,2,3352,69,2033520069,5,78,"PETER MARIS, JAMES MARIS",PEARL PLAZA.INC,2339 BLACKROCK AVENUE OFFICE 10462,45,5
61026,2018610,3366 DECATUR AVENUE,2,3355,104,2033550104,22,681,"MOSHE KATZENSTEIN, JACOB EISENSTEIN, SAM STITH, CARLOS ARZENO, JACOB ELSENSTEIN","EK REALTY, LLC",939 EIGHTH AVENUE 301 10019,5,105
61053,2017820,3520 DEKALB AVENUE,2,3328,143,2033280143,61,2207,"JACOB EISENSTEIN, HARRY EISENSTEIN, MARK EISENSTEIN, ISAAC EISENSTEIN, LAURA BOUCAI",DAVID EISENSTEIN REAL ESTATE,244 WEST 54TH STREET 702 10019,5,105
61059,2017797,3551 DEKALB AVENUE,2,3328,39,2033280039,4,288,"FREDERICK GORDON, IGNACIO MARTINEZ, LINDA GORDON, CARROLL SINGER, CATHY MCENTIRE",MILTON GORDON MANAGEMENT CORP,6485 BROADWAY 1C 10471,332,4
61736,2068520,4210 DIGNEY AVENUE,2,5006,69,2050060069,3,61,"NANCY HABER, LORENZO MASON, LOUIS CLARKE, MARCO VASQUEZ",NONE,110 EAST END AVENUE 8GH 10028,96,3
63231,2000431,419 EAST 142 STREET,2,2287,83,2022870083,7,117,"JONATHAN ROSENBERG, STEVE ROSEN, R ROSEN, JOHATHAN ROSENBERG, SPENCER THROWER",136 WEST 129 LLC,1449 37TH STREET 420 11218,192,7
63677,2000888,286 EAST 149 STREET,2,2330,14,2023300014,1,12,KHARULLAH MOHAMMAD,286 EAST 149 REALTY CORP,286 EAST 149TH STREET 10451,258,1
64641,2005206,851 EAST 163 STREET,2,2690,100,2026900100,31,1555,"SAM APPLEGRAD, ARIE WEISSMAN, SAN APPLEGRAD, MICHAEL EDERY, ARIE WIESSMAN",YMY ACQUISITIONS,2918 AVE M 11210,77,71
64771,2002140,371 EAST 165 STREET,2,2428,37,2024280037,59,729,"MATT LEVI, JESSICA LEE, HENRY WRIGHT, ARON KAPELUSCHNIK, ALEX KOHN",MAPES REALTY PARTNERS LLC,1261 39TH STREET 3FL 11218,35,168
64871,2002267,315 EAST 166 STREET,2,2434,44,2024340044,51,1277,"ROBERT RAPHAEL, NELSON COLON, LUIS RUIZ, ISRAEL ACEVEDO, WINSTON KING",GILMAN MANAGEMENT CORP.,55 WATERMILL LANE 100 11021,27,51
64873,2002268,321 EAST 166 STREET,2,2434,45,2024340045,56,763,"JONATHAN KOWITZ, JOSH KOWITZ, OSCAR KOHN, MARK KOHN, DEBBY KOHN",CSN PROPERTIES,858 BECK STREET B2 10459,263,56
64875,2002232,336 EAST 166 STREET,2,2433,59,2024330059,10,128,"MATT DAVIDSON, STEVE MAKOWSKI, STEVE MAKOWSK, STEVE MAKOWSKIU, STEVEN MAKOWSKY",RESPONSIVE MANAGEMENT,PO BOX 315TH 11516,266,10
65036,2002770,214 EAST 168 STREET,2,2457,21,2024570021,101,2698,"PESACH MILLER, MOSHE STAHL, GEORGE ZAYAS, ARI EDELL, HARRY GARTNER",EAST 117TH REALTY LLC,102 EAST 116TH STREET ST1 10029,173,108
65740,2008217,65 EAST 175 STREET,2,2850,67,2028500067,46,2802,"ANTHONY PISTILLI, JOSEPH PISTILLI, JOESPH PISTILLI, MICHAEL PISTILLI, MICHAEL G PISTILLI",LIDIA MANAGEMENT CORP,3501 30TH AVENUE 300 11103,97,46
65814,2007568,265 EAST 176 STREET,2,2802,44,2028020044,3,86,"JACK NDREU, PRENCA DELOVIC, NDREU NDREU",ESOR MANAGEMENT LLC,3044 KINGSBRIDGE AVENUE 1E 10463,291,3
65867,2007635,105 EAST 177 STREET,2,2806,1,2028060001,61,2207,"JACOB EISENSTEIN, HARRY EISENSTEIN, MARK EISENSTEIN, ISAAC EISENSTEIN, LAURA BOUCAI",DAVID EISENSTEIN REAL ESTATE,244 WEST 54TH STREET 702 10019,5,105
65871,2092059,12 EAST 177 STREET,2,2852,14,2028520014,102,748,"JOE REDEK, JOE RETEK, JOEL RETEK, MORDECHAI RETEK, BERL HOROWITZ",WILLIAMSBURG PROPERTY MANAGEMENT LLC,455 PARK AVENUE 11205,7,766
66111,2092250,615 EAST 179 STREET,2,3069,103,2030690103,5,66,"LASH KOCOVIC, LENA KOCOVIC, CRUZ RUTONIS, FRANJO MARDONOVIC, CARMEN SULLIVAN",LLK REALTY LLC,1865 EDISON AVENUE GIF 10461,310,5
66676,2010999,355 EAST 187 STREET,2,3022,73,2030220073,46,2802,"ANTHONY PISTILLI, JOSEPH PISTILLI, JOESPH PISTILLI, MICHAEL PISTILLI, MICHAEL G PISTILLI",LIDIA MANAGEMENT CORP,3501 30TH AVENUE 300 11103,97,46
66779,2011051,307 EAST 188 STREET,2,3023,99,2030230099,2,49,"BESIM PERVIZAJ, TEMENOUJKA PERVIZAJ","OWL CREEK PROPERTIES, LLC",6446 84TH STREET 11379,307,2
66780,2011050,311 EAST 188 STREET,2,3023,98,2030230098,45,1325,"MICHAEL ARYEH, BRIAN NEWMAN, ISAAC ARYEH, RYAN ZAR, AARON MECHLOVICS",2162-68 8TH AVENUE REALTY LLC,825 EIGHTH AVENUE 18N 10019,24,445
66878,2016605,301 EAST 193 STREET,2,3287,1,2032870001,90,1210,"JOSEPH SOLEIMANI, JULIO CHABLA, JOE SOLEIMANI, JOSE TORRES, JOSEPH SOLEIMANO","ABJ CHOSEN, LLC.",1652 PARK AVENUE LL 10035,172,90
66891,2092498,265 EAST 194 STREET,2,3294,2,2032940002,5,132,"ARI LOWY, MANNY HIJOSA, MANNY HINOJOSA, NICHOLAS FLAZ, JOSE ACOSTA",SHERIDAN MANAGEMENT,129 NORTH COUNTY LINE ROAD 148 08527,271,5
67000,2017140,219 EAST 196 STREET,2,3304,80,2033040080,135,6206,"BEN RIEDER, JONATHAN WIENER, JORGE LOVERA, CHRISTIAN MALOTA, RICK MARTINEZ","CHESTNUT HOLDINGS OF NEW YORK, INC",5676 RIVERDALE AVENUE 307 10471,128,135
67052,2016651,315 EAST 196 STREET,2,3288,10,2032880010,69,4482,"VED PARKASH, JAINE PEREZ, ANTON ANTHONY, JULIO VILLARS",PARKASH 242 LLC,17214 89TH AVENUE 11432,273,69
67114,2017587,1 EAST 198 STREET,2,3319,29,2033190029,2,123,ELEZ HAXHIJAJ,"BUJAR PROPERTIES GROUP, LLC",2830 MORRIS AVENUE 1B 10468,331,2
67128,2017146,206 EAST 198 STREET,2,3304,126,2033040126,39,713,"ABE PETERS, ABE PULTMAN, MARK MEHLMAN, ABE JAFFA, JACOB KATZENSTEIN",VILLA HOFFMAN REALTY GROUP,2392 NOSTRAND AVENUE 11210,249,39
67427,2017372,174 EAST 206 STREET,2,3312,14,2033120014,39,703,"ISSAKA MAIGUZO, DENNIS RIVERA, RAMIN RODFAR, GABRIEL GARCIA, ILLIAS BALLENILA",1970 UNIVERSITY LLC,36 WEST 37TH STREET 10018,0,1152
67515,2018400,315 EAST 209 STREET,2,3348,81,2033480081,34,936,"NICK GAZIVODA, MARTIN VUKSANAJ, NICK VUKSANAJ, NARSINH DESAI, NUE VUKSANAJ",1194-1196 BROOK CORP,287 EAST GUN HILL ROAD 10467,260,35
67518,2018584,364 EAST 209 STREET,2,3355,27,2033550027,19,223,"MIKE MANDEL, YIDDY LEBOWITZ, JOHN FURTH, MOSHE MANDEL, AARON LEBOVITZ",BEACH 99 100 D LLC,49 BARTLETT STREET 11206,334,19
67521,2018622,375 EAST 209 STREET,2,3355,156,2033550156,5,132,"ARI LOWY, MANNY HIJOSA, MANNY HINOJOSA, NICHOLAS FLAZ, JOSE ACOSTA",SHERIDAN MANAGEMENT,129 NORTH COUNTY LINE ROAD 148 08527,271,5
68193,2057872,766 EAST 215 STREET,2,4662,56,2046620056,14,328,"VICENTE CERVANTES, LUIS FERMIN, JEFFREY FREEDMAN, JIMMY LONDONO, RAMIRO HERNANDEZ",BRIDGESTONE GROUP LLC,1530 MCDONALD AVENUE D 11230,278,14
72197,2019758,530 EAST 234 STREET,2,3395,47,2033950047,20,412,"CHRISTOPHER VERNI, VITO VERNI, JOHN VERNI, IBISH OSMANAJ, INOCENCIO PEREZ",VERCO PROPERTIES LLC,ONE STATION PLAZA 2A 10543,76,20
73778,2017720,111 EAST MOSHOLU PARKWAY NORTH,2,3326,8,2033260008,5,384,"JOSE BENITEZ, SHIMON GREISMAN, CLAUDIUS ALEXANDER, ROMAN KALIKA, PETER ERLIKH",CHAMA HOLDING CORP,1306 GATEWAY BOULEVARD B 11691,77,71
