Building ID,BIN,Street Address,Borocode,Block,Lot,BBL,Number of buildings in portfolio (from WoW),Number of units in portfolio (from WoW),Top owners (from WoW),Top corporation name (from WoW),Top business address (from WoW),Virtual portfolio ID,Virtual portfolio BBL count
66,1044375,1149 1 AVENUE,1,1437,30,1014370030,10,451,"BERNARD GANS, PETER FRANCO, BERNIE GANS, JOSH KOPPEL, GINO FENECH",B. GANS MGT,110 EAST 30TH STREET 4FLOOR 10016,13,1581
93,1044741,1225 1 AVENUE,1,1441,23,1014410023,4,63,"SERGIO SPODEK, SAMUEL KAPLAN, DANIEL KAZSTELAN, SUSAN BERENHOLZ, ALDIN DERVISEVIC",DMB PROPERTIES INC,1695 LEXINGTON AVENUE STORE 10029,78,4
671,1040147,940 1 AVENUE,1,1363,49,1013630049,59,386,"MOSES KARPEN, LEO KLEIN, CHASKIEL STRULOVITCH, CHASKIEL STRULOWITZ, MOSES STRULOVITCH",WATERFRONT PROPERTY MANAGEMENT,116 NOSTRAND AVENUE 11205,157,135
962,1049909,1594 2 AVENUE,1,1545,51,1015450051,10,313,"SYNE KANACEVIC, ERIC KALIMIAN, LAILA SHIRIAN, FABIO GONZALEZ, TODD WITTENSTEIN",ELK 300 E 83 LLC,489 FIFTH AVENUE 8FLOOR 10017,94,10
964,1049908,1596 2 AVENUE,1,1545,50,1015450050,10,313,"SYNE KANACEVIC, ERIC KALIMIAN, LAILA SHIRIAN, FABIO GONZALEZ, TODD WITTENSTEIN",ELK 300 E 83 LLC,489 FIFTH AVENUE 8FLOOR 10017,94,10
1089,1050305,1830 2 AVENUE,1,1557,4,1015570004,96,1879,"ELY SAMUELS, KAMRAN HAKIM, ELLEN HAKIM, JOAN COHEN, MIRTHA AGUIRRE",EL-KAM REALTY,3 WEST 57TH STREET 6FLOOR 10019,91,96
1102,1050341,1854 2 AVENUE,1,1558,49,1015580049,5,104,"NORMAN SILVER, STEVE FOREST, VATE PAPUSHAJ, DAVID BERLEY, PETER WEISS","WALTER & SAMUELS, INC.",419 PARK AVENUE SOUTH 15FLOOR 10016,93,5
1142,1052674,2000 2 AVENUE,1,1675,1,1016750001,1,6,"FARIBA NABATIAN, BRONCO PEREZ",NAB 2000 REALTY LLC,10 CHANNEL DRIVE 11024,183,1
1183,1052801,2100 2 AVENUE,1,1680,1,1016800001,150,2555,"STEVE CROMAN, ANNABELLE SANTIAGO, STEVEN CROMAN, CATHY BURTON, JESUS CERTUCHE",NEW YORK CITY MANAGEMENT LLC,740 BROADWAY 10003,16,150
1232,1052892,2172 2 AVENUE,1,1683,51,1016830051,44,1214,YONAH HALTON,QUALITY BH 108TH MANHATTAN LLC,829 GREENWOOD AVENUE 1C 11218,75,44
1344,1054647,2409 2 AVENUE,1,1788,26,1017880026,19,200,"NASIR SASOUNESS, NASIR SASOUNESZ, NASIR SASOUNEIS, NASIR SAJOUNESS, NASIN SASOUNESS",SASSON RTY MGR,2242 SECOND AVENUE 10029,58,19
1376,1020464,316 2 AVENUE,1,924,4,1009240004,72,197,"MANSOUR MEHDIZADEH, TONY ZADEH, DAVID DILMANIAN, AREF SHAHIPOUR, MANSOUR MEHDZIADEH",BROOKVILLE HOMES LLC,14720 HILLSIDE AVENUE 11435,126,72
1498,1020188,643 2 AVENUE,1,916,30,1009160030,45,558,"JOEL RADMIN, ROBERT FARHADIAN, ARLENE RADMIN, WILLIAM RADMIN, MAHAN KIUMEHR",SIR REALTY,44 EAST 32ND STREET 9FLOOR 10016,33,71
1499,1020189,645 2 AVENUE,1,916,31,1009160031,26,217,"JOEL RADMIN, ARLENE RADMIN, WILLIAM RADMIN, ROBERT FARHADIAN, HERMAN GANS",SIR REALTY,44 EAST 32ND STREET 900 10016,33,71
1521,1020357,707 2 AVENUE,1,919,27,1009190027,42,2377,"PAUL HOWARD, SOPHIA LAMAS, ADIS SAHMANOVIC, CHRISTOPHER ORPHEUS, RROK BUNJAJ","BLDG MANAGEMENT CO., INC.",417 FIFTH AVENUE 400 10016,82,42
1823,1048056,1562 3 AVENUE,1,1516,39,1015160039,7,104,"KOSTAS ZACHARIADIS, ANTHONY ZACHARIADIS, CHALIO PEREA, ZACH ZACHARIADIS, CHALIO PERERRA",TOMAR EQUITIES LLC,346 EAST 59TH STREET 1 10022,74,7
1845,1048125,1598 3 AVENUE,1,1518,38,1015180038,9,146,"DAVID SIMHAEE, SHAHRAM TAIED, EDILBERTO ABREU, OTTO GIRON, ZAIM BAJRAKTAREVIC",GREAT AMERICAN CARE LLC,225 WEST 37TH STREET 6FLOOR 10018,162,9
1952,1052040,1936 3 AVENUE,1,1634,39,1016340039,22,158,"DEREK COHN, GERALDO RIVERA, DEREK COHEN, LEONARD ROSS",TEAM PROPERTIES LLC,1950 THIRD AVENUE 2FLOOR 10029,163,22
1975,1052434,1985 3 AVENUE,1,1659,1,1016590001,1,62,YI HAN,1989 3 AVE LLC,8626 QUEENS BOULEVARD 2FLOOR 11373,179,1
2199,1018114,350 3 AVENUE,1,881,45,1008810045,92,1347,"TERRENCE LOWENBERG, TODD COHEN, FRANK FIGUEROA, WALLY ACEVEDO, WAYNE WILLIAMS","T&T REALTY MANAGEMENT, LLC",419 LAFAYETTE STREET 5FLOOR 10003,40,92
2259,1018481,478 3 AVENUE,1,888,41,1008880041,2,25,"ALAN JAMNIK, RAMY JAMNIK","A & R 1392 REALTY, LLC",217 WOODBUR ROAD 154 11797,119,2
3378,1055002,1851 ADAM C POWELL BOULEVARD,1,1822,7502,1018227502,131,6521,"ANTHONY PAGAN, ALEXANDER SARI, TAMER KAYACAN, HEATHER PEATY, RYAN SOLARI",NEW BEDFORD MANAGEMENT,210 EAST 23RD STREET 5FLOOR 10010,0,1152
3438,1057699,2035 ADAM C POWELL BOULEVARD,1,1906,62,1019060062,10,160,"MARIEL JAVIER, EMMANUEL KU, JOSHUA KU, ALEXA FORBES",MERCY HOLDING LLC.,587 BECK STREET 10455,174,10
3619,1060482,2500 ADAM C POWELL BOULEVARD,1,2031,29,1020310029,33,996,"SOLOMON GOTTLIEB, CRUZ MITRE, RAMON ARMENTE, NICK EVANGALISTA, WILSON LLIGUICHUZHCA",NOAM CORP,1428 36TH STREET 219 11218,101,33
4220,1060901,2923 FREDERICK DOUGLASS BOULEVARD,1,2047,36,1020470036,0,,,,,225,1
5036,1080026,3854 10 AVENUE,1,2219,29,1022190029,48,1730,"JULIA RODRIGUEZ, BAJRAM BICIC, KITTY HUANG, ADIS LUCEVIC, DAVID GOLDWASSER",SILVERSTONE PROPERTY GROUP,520 MADISON AVENUE 35FLOOR 10022,25,48
5037,1064508,3855 10 AVENUE,1,2203,1,1022030001,40,1330,"TONY HUANG, GEORGE HUANG, ADRIANO DELEON, LUIS RESTREPO, RIGOBERTO JIMENEZ",2555-2559 GRAND CONCOURSE HEIGHTS ASSOC LLC,369 EAST 62ND STREET 10065,211,40
5390,1064805,618 ACADEMY STREET,1,2224,22,1022240022,73,4814,"PETER REBENWURZEL, MICHAEL HAAS, YOSSI GOLDBERG, EZRA BETECH, EPHRAIM NIERENBERG","159 BAY REALTY, LLC",1499 CONEY ISLAND AVENUE 11230,34,137
5447,1005493,125 ALLEN STREET,1,415,33,1004150033,48,1730,"JULIA RODRIGUEZ, BAJRAM BICIC, KITTY HUANG, ADIS LUCEVIC, DAVID GOLDWASSER",SILVERSTONE PROPERTY GROUP,520 MADISON AVENUE 35FLOOR 10022,25,48
5570,1059636,1467 AMSTERDAM AVENUE,1,1970,65,1019700065,8,181,"KHALIL SIKANDER, ADRIAN CURLEY, MARCELO ANGUISACA, MARIO CHAVEZ",GLIMMER GROUP USA INC,23 KIRBY LANE 11753,140,8
5577,1059739,1484 AMSTERDAM AVENUE,1,1987,31,1019870031,36,1012,"MORRIS ARLOS, TANNER TEW, DOUGLAS PETERSON, MYNOR OSORIO, PABLO SAQUICUYA",CITY SKYLINE REALTY INC,507 WEST 139TH STREET A 10031,205,36
5601,1061738,1616 AMSTERDAM AVENUE,1,2071,36,1020710036,15,306,"FERNANDO ALFONSO, LAZER STERNHELL, HOWARD FEDER, CAROL FEDER, JAY RAND",HCRD ENTERPRISES LLC,20945 45TH ROAD 2 11361,181,25
5602,1061193,1619 AMSTERDAM AVENUE,1,2057,29,1020570029,135,6806,"EFSTATHIOS VALIOTIS, NICK CONWAY, SOCRATES FORADOULAS, NICHOLAS CONWAY, GEORGE SAKELLARIS",ALMA REALTY CORP,3110 37TH AVENUE 500 11101,131,135
5606,1061214,1627 AMSTERDAM AVENUE,1,2057,56,1020570056,135,6806,"EFSTATHIOS VALIOTIS, NICK CONWAY, SOCRATES FORADOULAS, NICHOLAS CONWAY, GEORGE SAKELLARIS",ALMA REALTY CORP,3110 37TH AVENUE 500 11101,131,135
5647,1061431,1761 AMSTERDAM AVENUE,1,2062,1,1020620001,76,4165,"HALIL LJESNJANIN, GERALD PINDUS, ISIDRO HERNANDEZ, YAHA MOAELEL, ELLIOT BLATTBERG",METROPOLITAN PROPERTY SERVICES INC,14150 85TH ROAD 11435,104,82
5667,1062037,1792 AMSTERDAM AVENUE,1,2080,34,1020800034,9,92,ELI GIBBER,CROWN HEIGHTS HOLDINGS LLC,933 EAST FIFTH STREET 11230,220,9
5685,1061588,1835 AMSTERDAM AVENUE,1,2065,61,1020650061,5,142,"FERNANDO ALFONSO, LAZER STERNHELL, KEILLY CRUZ, JOAN PEGUERO, LAZER STERHELL",AMSTERDAM 1835 HOLDINGS LLC,20945 45TH ROAD 2 11361,181,25
5704,1061651,1883 AMSTERDAM AVENUE,1,2068,2,1020680002,30,998,"SHAUL KOPLOWITZ, DOV SHREBER, DOV SHREBBER, BIONDYS DURAN, FRANCISCO DIAZ",AMSTERDAM 1883-1887 LLC,1 HILLCREST CENTER DRIVE 230 10977,194,30
5705,1061652,1885 AMSTERDAM AVENUE,1,2068,3,1020680003,30,998,"SHAUL KOPLOWITZ, DOV SHREBER, DOV SHREBBER, BIONDYS DURAN, FRANCISCO DIAZ",AMSTERDAM 1883-1887 LLC,1 HILLCREST CENTER DRIVE 230 10977,194,30
5706,1061653,1887 AMSTERDAM AVENUE,1,2068,4,1020680004,30,998,"SHAUL KOPLOWITZ, DOV SHREBER, DOV SHREBBER, BIONDYS DURAN, FRANCISCO DIAZ",AMSTERDAM 1883-1887 LLC,1 HILLCREST CENTER DRIVE 230 10977,194,30
5776,1062899,2104 AMSTERDAM AVENUE,1,2121,43,1021210043,135,6206,"BEN RIEDER, JONATHAN WIENER, JORGE LOVERA, CHRISTIAN MALOTA, RICK MARTINEZ","CHESTNUT HOLDINGS OF NEW YORK, INC",5676 RIVERDALE AVENUE 307 10471,128,135
5779,1062897,2108 AMSTERDAM AVENUE,1,2121,39,1021210039,45,755,"ISSAKA MAIGUZO, MICHAEL BESSE, DENNIS RIVERA, MANJULA MUKHOPADHYAY, RICK ELEZI",REM RESIDENTIAL,36 WEST 37TH STREET 10018,0,1152
5796,1062660,2143 AMSTERDAM AVENUE,1,2111,81,1021110081,21,395,"SHAULI BECHER, BAHRAM HAKAKIAN, RAVINDER ANNAMANENI",ALLIED REALTY & DEVELOPMENT CORP,9 PARK PLACE 201 11021,3,21
5823,1063054,2228 AMSTERDAM AVENUE,1,2127,46,1021270046,29,1008,"ALBERT ABRAHAM, MIKE SPIRA, JAY JAFFE, STEVE SPERA, RAPHAEL KOHANTEB",ST NICHOLAS 24 LLC,27 AUDUBON AVENUE BSMT 10032,175,29
5836,1063171,2304 AMSTERDAM AVENUE,1,2131,48,1021310048,29,471,"ISSAKA MAIGUZO, MICHAEL BESSE, MANJULA MUKHOPADHYAY, DENNIS RIVERA, RICK ELEZI",REM RESIDENTIAL,36 WEST 37TH STREET 10018,0,1152
5842,1063191,2372 AMSTERDAM AVENUE,1,2132,40,1021320040,92,3107,"RICK HERMAN, MAURICE MCKENZIE, ANTON POPOVIC, EDWARD OSTAD, JORGE GUARACA",PARK AVE SOUTH MGMT,560 WEST 180TH STREET 306 10033,50,127
5843,1063190,2374 AMSTERDAM AVENUE,1,2132,38,1021320038,92,3107,"RICK HERMAN, MAURICE MCKENZIE, ANTON POPOVIC, EDWARD OSTAD, JORGE GUARACA",PARK AVE SOUTH MGMT,560 WEST 180TH STREET 306 10033,50,127
5846,1063607,2400 AMSTERDAM AVENUE,1,2152,53,1021520053,67,963,"ALANA STRIDIRON, RICK ELEZI, NOAH OSNOS, CHRIS FLORES, LARA LAPYSH",R.E.M. RESIDENTIAL,36 WEST 37TH STREET 8FLOOR 10018,0,1152
5857,1063577,2461 AMSTERDAM AVENUE,1,2149,8,1021490008,432,50831,"DONNA WEINBERG, MARIO FIGUEROA, ONEEKA WILLIAMS, ANGELO BRUNO, RANDY SULZER","FIRSTSERVICE RESIDENTIAL NEW YORK, INC.",622 THIRD AVENUE 14FLOOR 10017,0,1152
5951,1032782,488 AMSTERDAM AVENUE,1,1231,33,1012310033,8,85,"ZALMEN BIEDERMAN, COLUMBUS PROPER, ZALMEN BIDERMAN, PACO PACO, MENDY DEUTSCH",24 HAVEMEYER STREET,183 WILSON STREET 234 11211,151,8
5964,1032136,509 AMSTERDAM AVENUE,1,1215,64,1012150064,7,169,"MARC SHORE, RORY GILMARTIN, WILLIAM SHORE, JONATHAN SIMON, PEDRO FIGUEROA",CHARLES THOMPSON LLC,19 WEST 21ST STREET 902 10010,84,7
5966,1032135,511 AMSTERDAM AVENUE,1,1215,63,1012150063,7,169,"MARC SHORE, RORY GILMARTIN, WILLIAM SHORE, JONATHAN SIMON, PEDRO FIGUEROA",CHARLES THOMPSON LLC,19 WEST 21ST STREET 902 10010,84,7
5979,1033214,572 AMSTERDAM AVENUE,1,1235,35,1012350035,4,56,FRANK ORTIZ,AMSTERDAM 88 LLC,200 WEST 88TH STREET 1C 10024,152,4
6011,1033650,700 AMSTERDAM AVENUE,1,1241,36,1012410036,40,808,"ERIC BORKOWSKI, LUKASZ STAPOR, MARTIN NEWMAN, ADAM DENSKY, JOSH HALEGUA",CITI URBAN MGMT CORP,6 GRACE AVENUE 400 11021,47,40
6130,1064208,33 ARDEN STREET,1,2174,193,1021740193,7,158,"JOEL GLUCK, JOSE RAPOSO, LUIS LOPEZ, MICHAEL KOCOVIC, JOSE BELTRE",ARDEN 29 LLC,28 WEST 44TH STREET 912 10036,107,7
6131,1064197,34 ARDEN STREET,1,2174,175,1021740175,29,1008,"ALBERT ABRAHAM, MIKE SPIRA, JAY JAFFE, STEVE SPERA, RAPHAEL KOHANTEB",ST NICHOLAS 24 LLC,27 AUDUBON AVENUE BSMT 10032,175,29
6171,1063042,104 AUDUBON AVENUE,1,2127,15,1021270015,30,2274,"EFFI WEISS, EPHRAIM WEISS, IRVING LANGER, EFFIE WEISS, NAFTOLI LEINER",GALIL MANAGEMENT,331 EDGECOMBE AVENUE 100 10031,198,41
6182,1063099,145 AUDUBON AVENUE,1,2129,30,1021290030,42,1103,"MARVIN BASCH, JONATHAN SAMET, BERNY RODRIGUEZ, LEON GOLDENBERG, BRYAN VOLTA",US REALTY CORP,1360 EAST 14TH STREET 11230,133,71
6197,1063221,206 AUDUBON AVENUE,1,2133,20,1021330020,21,395,"SHAULI BECHER, BAHRAM HAKAKIAN, RAVINDER ANNAMANENI",ALLIED REALTY & DEVELOPMENT CORP,9 PARK PLACE 201 11021,3,21
6206,1063183,247 AUDUBON AVENUE,1,2132,21,1021320021,47,1352,"LEWIS BARBANEL, ROBERT SILVERMAN, ASTI ROSARIO, PANOS PAPADONIOU, LEWIS BARBANAL",BARBERRY ROSE MANAGEMENT CO. INC.,1024 BROADWAY 11598,20,48
6247,1063730,411 AUDUBON AVENUE,1,2156,39,1021560039,15,422,"HARRY HIRSCH, ERIC OPPENHEIMER, LUIS ALVAREZ, DAVID KORNITZER",3203 OXFORD REALTY LLC,428 CENTRAL AVENUE 201 11516,224,15
6257,1063813,440 AUDUBON AVENUE,1,2158,16,1021580016,15,571,"YECHESKEL EISENBACH, YEHUDA MENDLOWITS, EUGENE MENDLOWITS, DAVID LIMA, EUGENE MENDLOWITZ C/O CRE MGMT",YMY MANAGEMENT,102 DIVISION 11211,153,19
6284,1063020,79 AUDUBON AVENUE,1,2126,28,1021260028,29,1008,"ALBERT ABRAHAM, MIKE SPIRA, JAY JAFFE, STEVE SPERA, RAPHAEL KOHANTEB",ST NICHOLAS 24 LLC,27 AUDUBON AVENUE BSMT 10032,175,29
7437,1003908,85 BOWERY,1,303,11,1003030011,6,36,"DOUGLAS MINO, MARC SUTTON, JOSEPH BETESH, MARK SUTTON, DOUG MINO",BOWERY 8385 LLC,15 WEST 37TH STREET 11FLOOR 10018,15,6
7977,1059852,3149 BROADWAY,1,1993,81,1019930081,31,563,"TREASURE SANEY, GREGORY BUCKS, ANDREW MILLER, ATDHE KATONA, FIDAN SADIKU",122 STREET PORTFOLIO LLC,27 UNION SQUARE WEST 503 10003,72,31
8016,1059959,3351 BROADWAY,1,2002,34,1020020034,68,6832,"LAURENCE GLUCK, SMAJLJE SRDANOVIC, RAMSES CAPELLAN, ARIANIT JAKUPAJ, BOBBY GUTTENBERG",STELLAR MANAGEMENT,156 WILLIAM STREET 10FLOOR 10038,10,78
8050,1062347,3489 BROADWAY,1,2089,33,1020890033,8,719,"YEHUDA MENDLOWITS, EUGENE MENDLOWITS, YIDES MENDLOWITS, ELLIOT NEUMANN, MIKE TELESFORD",YMY MANAGEMENT,1644 58TH STREET 11204,153,19
8060,1061896,3520 BROADWAY,1,2076,1,1020760001,40,1828,"STUART GOLDSTEIN, JAMES VEST, EDWARD FOX, JOSE RIVERA, DOMINGO GARCIA",SDG MANAGEMENT CORP,888 SEVENTH AVENUE 24FLOOR 10019,92,40
8096,1062137,3640 BROADWAY,1,2082,1,1020820001,6,144,"RIKIN SHETH, EHSAN BEN REYHANIAN, EHSAN REYHANIAN, GAUTAM NAGARMAT, MAXIM MECHSHERYAKOV",BERIK MANAGEMENT,115 WEST 29TH STREET 908 10001,1,90
8103,1062176,3660 BROADWAY,1,2083,1,1020830001,22,712,"KOBI ZAMIR, JUSTIN GRANIERO, JUSTIN GRAINERO","BIG CITY REALTY MANAGEMENT, LLC",555 WEST 151ST STREET BSMT 10031,210,22
8104,1062456,3661 BROADWAY,1,2098,29,1020980029,40,1828,"STUART GOLDSTEIN, JAMES VEST, EDWARD FOX, JOSE RIVERA, DOMINGO GARCIA",SDG MANAGEMENT CORP,888 SEVENTH AVENUE 24FLOOR 10019,92,40
8106,1062457,3671 BROADWAY,1,2098,36,1020980036,17,463,"ROBERT SEIDEN, GILI HABERBERG, ALFRED LEKA, JUAN CORTINA, MARY REYES",ARKAR INC,331 EAST HOUSTON STREET OFFICE 10002,37,17
8118,1062252,3694 BROADWAY,1,2084,62,1020840062,36,1012,"MORRIS ARLOS, TANNER TEW, DOUGLAS PETERSON, MYNOR OSORIO, PABLO SAQUICUYA",CITY SKYLINE REALTY INC,507 WEST 139TH STREET A 10031,205,36
8141,1062783,3820 BROADWAY,1,2118,1,1021180001,16,319,"FERNANDO ALFONSO, LAZER STERNHELL, HOWARD FEDER, CAROL FEDER, JAY RAND",HCRD ENTERPRISES LLC,20945 45TH ROAD 2 11361,181,25
8146,1063350,3841 BROADWAY,1,2137,11,1021370011,12,568,"SUSAN EDELSTEIN, SUSAN EDESLTEIN, ADINOBAL CORDERO, ISMAEL VEGA, ALADDIN DIAZ",SUCCESSFUL MANAGEMENT CORP,145 WEST 71ST STREET 1A 10023,201,12
8149,1062823,3856 BROADWAY,1,2119,5,1021190005,46,1495,"LEWIS BARBANEL, ROBERT SILVERMAN, ASTI ROSARIO, PANOS PAPADONIOU, LEWIS BARBANAL",BARBERRY ROSE MANAGEMENT CO. INC.,1024 BROADWAY 11598,20,48
8155,1062922,3880 BROADWAY,1,2122,48,1021220048,40,1828,"STUART GOLDSTEIN, JAMES VEST, EDWARD FOX, JOSE RIVERA, DOMINGO GARCIA",SDG MANAGEMENT CORP,888 SEVENTH AVENUE 24FLOOR 10019,92,40
8160,1062924,3900 BROADWAY,1,2122,58,1021220058,46,1495,"LEWIS BARBANEL, ROBERT SILVERMAN, ASTI ROSARIO, PANOS PAPADONIOU, LEWIS BARBANAL",BARBERRY ROSE MANAGEMENT CO. INC.,1024 BROADWAY 11598,20,48
8225,1064271,4197 BROADWAY,1,2176,70,1021760070,77,7897,"LAURENCE GLUCK, SMAJLJE SRDANOVIC, RAMSES CAPELLAN, ARIANIT JAKUPAJ, BESIM BESKOVIC",STELLAR MANAGEMENT,156 WILLIAM STREET 10FLOOR 10038,10,78
8255,1063931,4316 BROADWAY,1,2164,44,1021640044,27,525,"JENO GUTTMANN, JENO GUTTMAN, MOSHE SCHWEID, ROBERT GUTTMAN, FRAIDY RUBIN",1559 DEAN LLC,61 HARRISON AVENUE 1R 11211,223,27
8283,1064465,4441 BROADWAY,1,2180,505,1021800505,56,1540,"JOSH KOPPEL, DAVID PEREZ, SAM POLICICCHIO, DIONIS FLORES, SETH JONES",HSC MANAGEMENT CORP.,102 GRAMATAN AVENUE 10550,13,1581
8316,1064138,4640 BROADWAY,1,2172,30,1021720030,44,1214,YONAH HALTON,QUALITY BH 108TH MANHATTAN LLC,829 GREENWOOD AVENUE 1C 11218,75,44
8317,1064139,4648 BROADWAY,1,2172,32,1021720032,44,1214,YONAH HALTON,QUALITY BH 108TH MANHATTAN LLC,829 GREENWOOD AVENUE 1C 11218,75,44
9336,1010843,24 CHARLES STREET,1,611,45,1006110045,91,1619,"JUSTIN HOLLANDER, MARTIN HOLLANDER, EVAN HOLLANDER, ROSE NIGRO, NOEL DEVINE",MARIN MANAGEMENT CORP,157 EAST 25TH STREET 10010,26,91
9513,1011172,85 CHRISTOPHER STREET,1,619,81,1006190081,91,1936,"ADAM STRYKER, FRIEDMAN MANAGEMENT CORP., REBECCA GARCIA, MARIO MCBEATCH, SAL RADONCIC",FRIEDMAN MANAGEMENT CORP,14 PENN PLAZA 2010 10122,59,95
9614,1059860,192 CLAREMONT AVENUE,1,1993,102,1019930102,125,4064,"CARL BORENSTEIN, JAMES MAISTRE, SANDY ADELSBERG, ANDREW DUELL, FLAMINIU BOROCAN",VERITAS PROPERTY MANAGEMENT LLC,1995 BROADWAY 201 10023,12,125
9836,1055966,940 COLUMBUS AVENUE,1,1861,29,1018610029,4,91,"STEVE FOREST, NORMAN SILVER, VATE PAPUSHAJ, DAVID BERLEY, LINDA GRABOW",WALTER & SAMUELS INC,419 PARK AVENUE SOUTH 15FLOOR 10016,93,5
9949,1061284,332 CONVENT AVENUE,1,2059,16,1020590016,2,9,"LISA SILVERSMITH, DONALD TRAMMEL",CONVENT 332 BETTERMENT CORP,41 EASTERN PARKWAY 10B 11238,226,2
10600,1004360,298 EAST 3 STREET,1,372,22,1003720022,1,9,GAIL DICKERSON,TENANTS OF 298 EAST 3RD ST HDFC,298 EAST THIRD STREET 1 10009,43,1
10857,1005068,531 EAST 5 STREET,1,401,48,1004010048,19,200,"NASIR SASOUNESS, NASIR SASOUNESZ, NASIR SASOUNEIS, NASIR SAJOUNESS, NASIN SASOUNESS",SASSON RTY MGR,2242 SECOND AVENUE 10029,58,19
11177,1006684,41 EAST 7 STREET,1,463,36,1004630036,92,2710,"JOHN ILIBASSI, JOHN KUCHARCZYK, DANIEL ILIBASSI, THOMAS MASTRANGELO, DAVID CHEN",15TH ASSOCIATES LLC,25311 80TH AVENUE 11004,36,92
11178,1006650,46 EAST 7 STREET,1,462,22,1004620022,20,392,"DAVID GROSSMAN, MICHAEL GRUNSKI, MARIA HRYNENKO, ANNA CHLEBAK, MIKE GRUNSKI",ALTO PROPERTY MANAGERS LLC,421 SEVENTH AVENUE 1500 10001,6,20
11972,1005262,513 EAST 13 STREET,1,407,54,1004070054,26,804,"MARK ELMAN, MICHAEL CRESPO, HARRY GREENBAUM, ERVIN GJINI, JOSE RODRIGUEZ",CITADEL PROPERTY MANAGEMENT CORP,513 EAST 13TH STREET 10009,14,26
12680,1019776,238 EAST 24 STREET,1,904,31,1009040031,5,32,"PAUL MANDEL, ANNE POSTYN, JOEL MANDEL, SHALOM WIEDER",FH PROPERTY GROUP LTD,7125 AUSTIN STREET 11375,122,5
16567,1045222,314 EAST 78 STREET,1,1452,41,1014520041,18,591,"HENRY MOSES JR, ROBERT MOSES, KELVIN TREVINO, HENRY MOSES, HENRY MOSES, JR",VANDERLEIGH PROPERTIES LLC,66 MARBLEDALE ROAD 10707,57,18
17485,1051206,504 EAST 84 STREET,1,1580,47,1015800047,1,10,"GERRY O'DOWD, MARIE DURIF",CALIMERO LTD,1461 FIRST AVENUE 192 10075,168,1
18447,1050265,322 EAST 93 STREET,1,1555,39,1015550039,9,104,"BESS FERN, ILIR METALIJA, SAUL CASTAGNELLO, BESS CASTAGNELLO, GAIL CASTAGNELLO",CASTAGNELLO REALTY LLC,221 WEST 79TH STREET 2F 10024,143,9
18451,1050263,326 EAST 93 STREET,1,1555,37,1015550037,11,315,"GEORGE RODRIGUEZ, ELEIZER SCHWIMER, BRAD RINZLER, MENDY SCHWIMER, DAVID STEINBERG",ELMORD MANAGEMENT LLC,543 543RD BEDFORD AV SUITE 267 267 11211,142,11
18912,1051904,118 EAST 103 STREET,1,1630,67,1016300067,98,2676,"PESACH MILLER, MOSHE STAHL, GEORGE ZAYAS, ARI EDELL, HARRY GARTNER",EAST 117TH REALTY LLC,102 EAST 116TH STREET ST1 10029,173,108
18974,1051935,168 EAST 104 STREET,1,1631,47,1016310047,23,422,"NABIL CHOWDHURY, AMRAM TEHRANI, JORGE GARCIA, TONY COSOVIC, PABLO VALENCIA",TRISTAR MANAGEMENT ASSOCIATES LLC,60 MADISON AVENUE 1001 10010,48,23
19039,1052403,212 EAST 105 STREET,1,1654,141,1016540141,150,2555,"STEVE CROMAN, ANNABELLE SANTIAGO, STEVEN CROMAN, CATHY BURTON, JESUS CERTUCHE",NEW YORK CITY MANAGEMENT LLC,740 BROADWAY 10003,16,150
19059,1052737,302 EAST 105 STREET,1,1676,148,1016760148,1,8,"SACHAL SOHAN, CARLOS RAMOS, ABRAHAM MALIK",302 EAST 105TH ST LLC,BOX 2185 STUYVESANT STATION 10009,185,1
19095,1052009,154 EAST 106 STREET,1,1633,51,1016330051,98,2676,"PESACH MILLER, MOSHE STAHL, GEORGE ZAYAS, ARI EDELL, HARRY GARTNER",EAST 117TH REALTY LLC,102 EAST 116TH STREET ST1 10029,173,108
19098,1052029,159 EAST 106 STREET,1,1634,28,1016340028,10,160,"MARIEL JAVIER, EMMANUEL KU, JOSHUA KU, ALEXA FORBES",MERCY HOLDING LLC.,587 BECK STREET 10455,174,10
19193,1052804,323 EAST 108 STREET,1,1680,15,1016800015,7,136,"DANTE CAPPI, CHRIS CAPPI, EDEL VASQUEZ",CAPPI HOLDING,2118 SECOND AVENUE 10029,184,7
19252,1077066,325 EAST 109 STREET,1,1681,13,1016810013,24,450,"MANUEL VALERIO, SARUHAN CAPIN, BATUHAN CAPIN, YINE ACOSTA, EIICHIRO KOBAYASHI",SOLAR REALTY MANAGEMENT CORP,36 MAPLE PLACE 303 11030,69,24
19382,1052482,214 EAST 111 STREET,1,1660,42,1016600042,18,341,"FERNANDO ALFONSO, LAZER STERNHELL, HOWARD FEDER, CAROL FEDER, BEHROOZ HEDVAT",RHODES 2 LLC,20945 45TH ROAD 2 11361,181,25
19530,1081497,21 EAST 115 STREET,1,1621,12,1016210012,1,10,ADRIANA SAKKAL,115 SNV ASSOCIATES LLC,545 WEST END AVENUE 5A 10024,171,1
19561,1052906,335 EAST 115 STREET,1,1687,19,1016870019,74,618,"AKIVA SHOOB, MORDECHAI KOSLOWITZ, ELLIOT HOROWITZ, THEODORE FELDHEIM, THEODORE FELDHIEM",DG FLATBUSH MANAGEMENT LLC,3008 AVENUE J 11210,53,74
19673,1052543,228 EAST 116 STREET,1,1665,38,1016650038,97,2646,"PESACH MILLER, MOSHE STAHL, GEORGE ZAYAS, ARI EDELL, HARRY GARTNER",EAST 117TH REALTY LLC,102 EAST 116TH STREET ST1 10029,173,108
19678,1052541,234 EAST 116 STREET,1,1665,34,1016650034,98,2676,"PESACH MILLER, MOSHE STAHL, GEORGE ZAYAS, ARI EDELL, HARRY GARTNER",EAST 117TH REALTY LLC,102 EAST 116TH STREET ST1 10029,173,108
19681,1052540,238 EAST 116 STREET,1,1665,33,1016650033,98,2676,"PESACH MILLER, MOSHE STAHL, GEORGE ZAYAS, ARI EDELL, HARRY GARTNER",EAST 117TH REALTY LLC,102 EAST 116TH STREET ST1 10029,173,108
19779,1051669,89 EAST 116 STREET,1,1622,30,1016220030,12,393,"AMEET SACHDEV, AKSHAY SACHDEV, SURESH SACHDEV, POONAM SACHDEV, HAYDN DENALLI","TOPAZ REALTY MANAGEMENT, LLC",52 EAST 13TH STREET 3A 10003,54,12
19855,1052617,231 EAST 117 STREET,1,1667,16,1016670016,98,2676,"PESACH MILLER, MOSHE STAHL, GEORGE ZAYAS, ARI EDELL, HARRY GARTNER",EAST 117TH REALTY LLC,102 EAST 116TH STREET ST1 10029,173,108
19867,1052972,316 EAST 117 STREET,1,1688,44,1016880044,98,2676,"PESACH MILLER, MOSHE STAHL, GEORGE ZAYAS, ARI EDELL, HARRY GARTNER",EAST 117TH REALTY LLC,102 EAST 116TH STREET ST1 10029,173,108
19869,1052970,322 EAST 117 STREET,1,1688,42,1016880042,98,2676,"PESACH MILLER, MOSHE STAHL, GEORGE ZAYAS, ARI EDELL, HARRY GARTNER",EAST 117TH REALTY LLC,102 EAST 116TH STREET ST1 10029,173,108
19870,1052969,326 EAST 117 STREET,1,1688,40,1016880040,98,2676,"PESACH MILLER, MOSHE STAHL, GEORGE ZAYAS, ARI EDELL, HARRY GARTNER",EAST 117TH REALTY LLC,102 EAST 116TH STREET ST1 10029,173,108
20040,1054809,411 EAST 118 STREET,1,1806,7,1018060007,97,2646,"PESACH MILLER, MOSHE STAHL, GEORGE ZAYAS, ARI EDELL, HARRY GARTNER",EAST 117TH REALTY LLC,102 EAST 116TH STREET ST1 10029,173,108
20192,1054858,406 EAST 119 STREET,1,1806,145,1018060145,4,50,"JENNIFER AQEL, HEDI BROOKS, ALEXANDER AQEL, SAID AQEL, HEIDI BROOKS",2305 SECOND CORP DBA AQEL MANAGEMENT,8 LINCOLN AVENUE 10502,197,4
20218,1054856,454 EAST 119 STREET,1,1806,128,1018060128,3,34,"FERNANDO DEMARQUET, FERNAND DEMARQUET, DORIS DEMARQUET",,460 EAST 115TH STREET 4R 10029,167,3
20394,1054619,212 EAST 122 STREET,1,1786,42,1017860042,12,145,"DORON KESSEL, SHARON YOGEV, PAWEL BATOG, UZI EVRON, PETER RIVERA",ORION INVESTMENT GROUP LLC,138 WEST 133RD STREET 10030,124,35
20471,1054021,1 EAST 124 STREET,1,1749,104,1017490104,2,15,"JACK CATTAN, VICTOR CENCEPCION, MARTIN RIVERA",1 EAST 124 LLC,37 WEST 37TH STREET 10FLOOR 10018,196,2
20563,1054016,14 EAST 125 STREET,1,1749,64,1017490064,11,36,"JEFFREY ROSENTHAL, JASON ROSE, ABE ROSENTHAL, YISROEL FONTEK, MORDECHAI RACHMINOV","BEACH 31, LLC",7520 VLEIGH PLACE 11367,195,11
20623,1054043,79 EAST 125 STREET,1,1750,32,1017500032,15,220,"MARK IRGANG, ELDRICK BODDEN, ANGEL PEREZ",475 WEST 145TH ST LLC,121 TWEED BOULEVARD 10960,176,15
21274,1061153,335 EDGECOMBE AVENUE,1,2053,96,1020530096,2,73,"CHICO GIBBONS, ARTHUR GIBBONS, CHARLIE WINSTON, CHARLES WINSTON",GIBBONS MANAGEMENT CORP,229 WEST 111TH STREET 10026,209,5
21285,1061169,375 EDGECOMBE AVENUE,1,2054,20,1020540020,6,81,"DAVID YAMINIAN, SUSAN YAMINIAN, AMIR SEDAGHAT",WESTCHESTER SQUARE PLAZA REALTY LLC,2482 GRAND CONCOURSE 10458,229,6
21329,1005429,106 ELDRIDGE STREET,1,413,1,1004130001,8,66,"CURTIS TRUONG, TONY MOY, KIET HA, VICTOR GONZALES, FEDERICO NIETO",NEWKEY REALTY LLC,6410 EIGHTH AVENUE 3A 11220,68,8
21429,1007131,164 ELIZABETH STREET,1,478,12,1004780012,40,808,"ERIC BORKOWSKI, LUKASZ STAPOR, MARTIN NEWMAN, ADAM DENSKY, JOSH HALEGUA",CITI URBAN MGMT CORP,6 GRACE AVENUE 400 11021,47,40
21516,1064140,108 ELLWOOD STREET,1,2172,39,1021720039,44,1214,YONAH HALTON,QUALITY BH 108TH MANHATTAN LLC,829 GREENWOOD AVENUE 1C 11218,75,44
21518,1064129,2 ELLWOOD STREET,1,2171,42,1021710042,143,10730,"DONALD HASTINGS, MAGGIE MCCORMICK, DONALD HASTING, BRIAN GARLAND, DOUGLAS EISENBERG","KEW GARDENS HILLS, LLC",1065 AVENUE OF THE AMERICAS 31FLOOR 10018,79,146
21574,1004038,43 ESSEX STREET,1,310,24,1003100024,5,58,"DEAN GALASSO, PAUL GALASSO, FRANK GOMEZ, PAUL ITALIA, STEVEN GATTO",GALATTO LLC,1 DUTCH 13B 10038,22,5
21598,1064101,85 FAIRVIEW AVENUE,1,2170,500,1021700500,42,972,"ELEANOR PATRICK, MEILECH WEISS, ARI NOE, JOEL BASCH, SHLOME REIFER",873-879 LLC,3611 14TH AVENUE 603 11218,112,44
21667,1063592,133 FT GEORGE AVENUE,1,2149,270,1021490270,35,1058,"JONATHAN RAMIREZ, STEVEN NEUMAN, MORDECAI LENT, SAUD AGANI, JONATHAN RAMIRIEZ",551-565 WEST 190 PROPERTY LLC,85 DELANCEY STREET 10002,189,40
21804,1063507,370 FT WASHINGTON AVENUE,1,2142,178,1021420178,146,11137,"DONALD HASTINGS, MAGGIE MCCORMICK, DONALD HASTING, BRIAN GARLAND, DOUGLAS EISENBERG","KEW GARDENS HILLS, LLC",1065 AVENUE OF THE AMERICAS 31FLOOR 10018,79,146
21849,1063358,66 FT WASHINGTON AVENUE,1,2137,46,1021370046,40,1828,"STUART GOLDSTEIN, JAMES VEST, EDWARD FOX, JOSE RIVERA, DOMINGO GARCIA",SDG MANAGEMENT CORP,888 SEVENTH AVENUE 24FLOOR 10019,92,40
21858,1063331,75 FT WASHINGTON AVENUE,1,2136,140,1021360140,18,630,"JONATHAN RAMIREZ, JONATHAN RAMIRIEZ, MICHAEL KOCOVIC, BETTY CRESPO, RICHARD COHEN",551-565 WEST 190 PROPERTY LLC,85 DELANCEY STREET 10002,189,40
21860,1063365,86 FT WASHINGTON AVENUE,1,2137,91,1021370091,41,3030,"MORRIS SCHREIBER, RICHARD EISENBERG, ANDY EAGLE, PERRY ZAHNER, AARON GOSS",RCR MANAGEMENT LLC,155 RIVERSIDE DRIVE 1D 10024,116,41
22841,1064130,34 HILLSIDE AVENUE,1,2171,52,1021710052,143,10730,"DONALD HASTINGS, MAGGIE MCCORMICK, DONALD HASTING, BRIAN GARLAND, DOUGLAS EISENBERG","KEW GARDENS HILLS, LLC",1065 AVENUE OF THE AMERICAS 31FLOOR 10018,79,146
