116931,2014747,2291 DR M L KING JR BOULEVARD,2,3218,64,2032180064,11,246,"MICHAEL RUBIN, ABE KRAMER, AMEET MATURU, MICHAEL RUBINO, FRANK RUBINO",CAP X REALTY SERVICES LLC,807 MEEHAN AVENUE 11691,146,11
116944,2014604,2332 UNIVERSITY AVENUE,2,3212,44,2032120044,31,1555,"SAM APPLEGRAD, ARIE WEISSMAN, SAN APPLEGRAD, MICHAEL EDERY, ARIE WIESSMAN",YMY ACQUISITIONS,2918 AVE M 11210,77,71
116968,2013285,2028 VALENTINE AVENUE,2,3142,9,2031420009,101,2698,"PESACH MILLER, MOSHE STAHL, GEORGE ZAYAS, ARI EDELL, HARRY GARTNER",EAST 117TH REALTY LLC,102 EAST 116TH STREET ST1 10029,173,108
117026,2013548,2185 VALENTINE AVENUE,2,3149,147,2031490147,69,4482,"VED PARKASH, JAINE PEREZ, ANTON ANTHONY, JULIO VILLARS",PARKASH 242 LLC,17214 89TH AVENUE 11432,273,69
117099,2013473,2474 VALENTINE AVENUE,2,3148,6,2031480006,5,146,"STEVEN KAPETANOS, ANGELA KAPETANOS",KAP CO REALTY GROUP CORP,3955 64TH STREET MGMT 11377,317,5
117107,2013617,2538 VALENTINE AVENUE,2,3154,68,2031540068,149,3802,"MARTIN KIRZNER, YOSSI KIRZNER, DAVID GREENWALD, JANITZA JIMENEZ, DANIEL CALLER",FSG REALTY HOLDINGS LLC,2365 NOSTRAND AVENUE 2FLOOR 11210,17,172
117787,2017307,3094 VILLA AVENUE,2,3310,23,2033100023,1,16,"KONSTANTINOS KOSTARIDIS, ISMET DZAFEROVIC, MATT DZAFEROVIC",VILLA PROPERTIES,3636 33RD STREET 11106,329,1
117797,2017324,3128 VILLA AVENUE,2,3311,10,2033110010,4,182,"ELI WULLIGER, CLARA CRESPO, MYRNA MALDONEDO, SASHELIN CRESPO",686 E234 REALTY LLC,5314 16TH AVENUE 243 11204,330,4
119029,2002949,1113 WALTON AVENUE,2,2478,40,2024780040,9,519,"SOL ZALMAN, CARL CHAIMS, NACHUM FINKELSTEIN, RAFAEL RIVERA, LUIS MENDEZ",FINK REALTY CORP,1246 SAGE STREET 11691,274,9
119033,2002960,1177 WALTON AVENUE,2,2479,36,2024790036,40,2082,"JOSEPH FRIEDMAN, SOL SINGER, EDWIN BIBILONI, MARK HALPERT, IRVIN CANNON",PRINCETON EQUITIES LLC,314 MCDONALD AVENUE 11218,267,40
119035,2002840,1184 WALTON AVENUE,2,2463,30,2024630030,10,496,"DAVID GUNSBERG, DAVID GINSBERG, ARON GUNSBERG, DAVID GUNSBURG, JEFFREY ADAMES",KINGSBRIDGE COURT APTS LLC,1744 EAST THIRD STREET 1FLOOR 11223,268,10
119068,2008199,1715 WALTON AVENUE,2,2849,76,2028490076,46,2802,"ANTHONY PISTILLI, JOSEPH PISTILLI, JOESPH PISTILLI, MICHAEL PISTILLI, MICHAEL G PISTILLI",LIDIA MANAGEMENT CORP,3501 30TH AVENUE 300 11103,97,46
119069,2008198,1727 WALTON AVENUE,2,2849,70,2028490070,46,2802,"ANTHONY PISTILLI, JOSEPH PISTILLI, JOESPH PISTILLI, MICHAEL PISTILLI, MICHAEL G PISTILLI",LIDIA MANAGEMENT CORP,3501 30TH AVENUE 300 11103,97,46
119091,2007910,1920 WALTON AVENUE,2,2828,5,2028280005,18,800,"MANNY STEIN, MARTIN MEYER, ELI TABAK, MENACHEM AUGENSTEIN, PD FAMILY SHELTER TRUST",ST. JOHNS HOLDINGS 2015 LLC,1175 GRAND CONCOURSE GR4 10452,28,50
119111,2007947,2030 WALTON AVENUE,2,2829,42,2028290042,92,3107,"RICK HERMAN, MAURICE MCKENZIE, ANTON POPOVIC, EDWARD OSTAD, JORGE GUARACA",PARK AVE SOUTH MGMT,560 WEST 180TH STREET 306 10033,50,127
119181,2014086,2357 WALTON AVENUE,2,3187,30,2031870030,2,107,"LEE BURTON, NOELLE BURTON, BEVERLY BURTON, THOMAS GOMEZ, DANIEL RAMIREZ",2357 WALTON LLC,4082 AMUNDSON AVENUE 10466,298,2
119285,2002915,975 WALTON AVENUE,2,2476,22,2024760022,31,1103,"MOE GREENZWEIG, LARRY JEREMIAS, JUDA STERN, SEAN SINNREICH, FRANSISCO VASQUEZ",1470 OCEAN LLC,1449 37TH STREET 608 11218,230,31
120366,2014764,2454 WEBB AVENUE,2,3219,94,2032190094,23,842,"MILAGROS MARTINEZ, STEPHEN CRAWFORD, FRANCISCO GARCIA, ARDA ARDAN, JOHN MARUKOS",TOTAL REALTY ASSOCIATES INC,733 YONKERS AVENUE 103 10704,186,23
120558,2013300,2031 WEBSTER AVENUE,2,3142,74,2031420074,7,281,"JAY RAND, MARIO URBINA, GENARO SERRANO, MARGARET SIRENA, EDUARDO VALDEZ",TWIN PARKS 2031 REALTY CORP,1068 BROOK AVENUE 10456,181,25
120577,2013311,2097 WEBSTER AVENUE,2,3143,122,2031430122,39,1732,"ANGELA GAZIVODA, ANTHONY GAZIVODA, HENRIK BERISHA, EDGAR VASCONEZ, ROBERTO JIMENEZ",GAZIVODA MANAGEMENT LLC,3331 WHITE PLAINS ROAD 101 10467,275,39
120578,2013310,2099 WEBSTER AVENUE,2,3143,121,2031430121,39,703,"ISSAKA MAIGUZO, DENNIS RIVERA, RAMIN RODFAR, GABRIEL GARCIA, ILLIAS BALLENILA",1970 UNIVERSITY LLC,36 WEST 37TH STREET 10018,0,1152
120815,2007440,1756 WEEKS AVENUE,2,2797,13,2027970013,4,11,RAY COSTELLO,COSTELLO HOLDING CORP,1510 CASTLE HILL AVENUE 331 10462,290,4
120830,2007901,1801 WEEKS AVENUE,2,2826,102,2028260102,8,324,"ALEX GAZIVODA, LEZE GAZIVODA, RUDOLF TORRES, RUDY CABRERA, MIKE RIVERA",APG REALTY CORP,4419 THIRD AVENUE 4C 10457,295,8
120834,2007514,1824 WEEKS AVENUE,2,2800,8,2028000008,29,364,"BENZION REIFER, BENZION RIEFER, BENZION REFIER, MARK TIKOTZY, EDWARD NEIGER",125-127 POST AVE RESIDENCE LLC,232 BROADWAY 400 11211,19,29
120927,2003453,155 WEST 162 STREET,2,2524,64,2025240064,77,722,"GABRIEL DORFMAN, SHLOMO KARPEN, ALAN MESSNER, ISIDOR MANDEL, JOE ZIKERMAN",NORTH BROOKLYN MANAGEMENT LLC,329 HEWES STREET 11211,157,135
120953,2003141,64 WEST 165 STREET,2,2508,24,2025080024,45,755,"ISSAKA MAIGUZO, MICHAEL BESSE, DENNIS RIVERA, MANJULA MUKHOPADHYAY, RICK ELEZI",REM RESIDENTIAL,36 WEST 37TH STREET 10018,0,1152
120954,2003140,74 WEST 165 STREET,2,2508,22,2025080022,45,755,"ISSAKA MAIGUZO, MICHAEL BESSE, DENNIS RIVERA, MANJULA MUKHOPADHYAY, RICK ELEZI",REM RESIDENTIAL,36 WEST 37TH STREET 10018,0,1152
121010,2008337,11 WEST 172 STREET,2,2859,92,2028590092,69,4482,"VED PARKASH, JAINE PEREZ, ANTON ANTHONY, JULIO VILLARS",PARKASH 242 LLC,17214 89TH AVENUE 11432,273,69
121107,2014862,150 WEST 179 STREET,2,3221,26,2032210026,7,288,"MARSHALL ROSE, NOE DIAZ, ANGEL DIAZ, JOSE HERNANDEZ, VICTOR VARGAS",M G ROSE LLC,2680 HEATH AVENUE 1A 10463,52,7
121162,2014202,27 WEST 181 STREET,2,3195,104,2031950104,10,186,"ANURADHA KUMAR, SID SID",GOLDFISH MANAGEMENT LLC,4049 72ND STREET 11377,316,10
121299,2014359,20 WEST 190 STREET,2,3200,14,2032000014,45,1027,"MICHAEL PADERNACHT, CHRIS LIM, NOAH FRIEDMAN, DERVISH BERISHA, DANIEL PADERNACHT",MIDAS PROPERTY MANAGEMENT,3605 SEDGWICK AVENUE 10463,18,45
121672,2084506,221 WEST 251 STREET,2,5825,1501,2058251501,1,13,"AGRON NRECAJ, VAL ROSSI, ANTON ROSSI, PRENK RASI",QUNI REALTY CORP,221 WEST 251 STREET 10471,342,1
122162,2008964,226 WEST TREMONT AVENUE,2,2877,516,2028770516,11,246,"MICHAEL RUBIN, ABE KRAMER, AMEET MATURU, MICHAEL RUBINO, FRANK RUBINO",CAP X REALTY SERVICES LLC,807 MEEHAN AVENUE 11691,146,11
125004,2000220,212 WILLIS AVENUE,2,2281,4,2022810004,57,193,"AMNON TOUAF, ISAAC FIALKOFF, RAMI ESSES, EREZ ITZHOKOV, MR LEVI",UNCLE SAM MANAGEMENT LLC,24019 JAMAICA AVENUE 11426,253,59
125640,2003135,1030 WOODYCREST AVENUE,2,2508,14,2025080014,67,2223,"JACOB EISENSTEIN, HARRY EISENSTEIN, JOSEPH TEICHMAN, MARK EISENSTEIN, ISAAC EISENSTEIN",DAVID EISENSTEIN REAL ESTATE,244 WEST 54TH STREET 702 10019,5,105
125650,2003148,1072 WOODYCREST AVENUE,2,2509,6,2025090006,81,2701,"JACOB EISENSTEIN, HARRY EISENSTEIN, ISAAC EISENSTEIN, MARK EISENSTEIN, MOSHE KATZENSTEIN",DAVID EISENSTEIN REAL ESTATE,244 WEST 54TH STREET 702 10019,5,105
125691,2003113,950 WOODYCREST AVENUE,2,2507,1,2025070001,48,584,"ALEX KOHN, HENRY WRIGHT, MATT LEVI, JESSICA LEE, ARON KAPELVSCHNIK",JWASSER,1261 39TH STREET 3RD FL 11218,35,168
125695,2003187,957 WOODYCREST AVENUE,2,2511,68,2025110068,48,584,"ALEX KOHN, HENRY WRIGHT, MATT LEVI, JESSICA LEE, ARON KAPELVSCHNIK",JWASSER,1261 39TH STREET 3RD FL 11218,35,168
125734,2007997,1414 WYTHE PLACE,2,2833,6,2028330006,135,6206,"BEN RIEDER, JONATHAN WIENER, JORGE LOVERA, CHRISTIAN MALOTA, RICK MARTINEZ","CHESTNUT HOLDINGS OF NEW YORK, INC",5676 RIVERDALE AVENUE 307 10471,128,135
125737,2008120,1459 WYTHE PLACE,2,2844,105,2028440105,190,6504,"MARK ENGEL, CESAR TORRES, LINDA HERNANDEZ, GERTRUDIS CLUNE, EDITH CARDONA",LANGSAM PROPERTY SERVICES CORP,1601 BRONXDALE AVENUE 201 10462,103,204
128432,3007956,105 3 PLACE,3,463,42,3004630042,1,8,"RALPH DI BENEDETTO, MARIA DI BENEDETTO",,105 THIRD PLACE 1R 11231,350,1
129209,3023364,524 4 AVENUE,3,1033,42,3010330042,1,6,"MITCH GORDON, MARSHALL SOLLENDER",524 47TH AVE INC,29 WEST 38TH STREET 14FLOOR 10018,373,1
129242,3014544,5416 4 AVENUE,3,822,39,3008220039,99,1334,"ARON KAPELUSCHNIK, ALEX KOHN, JESSICA LEE, MATT LEVI, HENRY MIZRAHI",JWASSER,1261 39TH STREET 3RD FL 11218,35,168
129366,3143388,6022 4 AVENUE,3,5781,41,3057810041,3,24,"MARIA FRANCO, NICK KALLERGRIS, MARIBEL FRANCO",375 LLC,159 92ND STREET 11209,294,3
129401,3144053,6302 4 AVENUE,3,5808,34,3058080034,19,164,"JACQUELINE ARROYO, MARIO VALDES, DELVIS VALDES",BROOKLYN MANAGEMENT CORP,4505 FIFTH AVENUE 200 11220,353,19
129406,3144056,6324 4 AVENUE,3,5808,40,3058080040,19,164,"JACQUELINE ARROYO, MARIO VALDES, DELVIS VALDES",BROOKLYN MANAGEMENT CORP,4505 FIFTH AVENUE 200 11220,353,19
130310,3020778,294 5 AVENUE,3,969,41,3009690041,1,7,"ISRAEL SEGAL, KASSEM METTA, DORIS MOSSERI",294 5TH AVENUE REALTY PARTNERS LLC,440 QUENTIN ROAD 11223,370,1
132098,3011953,4623 6 AVENUE,3,758,1,3007580001,6,33,"JANE YANG, DA YANG, JANE JIANG, Xiang Yang, EN WENG",WILLIAM YANG LLC,772 44TH STREET 11220,355,6
139892,3124904,4018 15 AVENUE,3,5345,51,3053450051,0,,,,,530,1
143621,3255744,333 18 STREET,3,874,71,3008740071,11,60,"VINCENT DING, LUIS NAVARRO, JASI NAVARRO",BROOKLINE MANAGEMENT,81 PROSPECT STREET 11201,366,11
143622,3016803,335 18 STREET,3,874,70,3008740070,1,6,LYHOU GINDI,LG 18 STREET LLC,1533 EAST SECOND STREET 11230,365,1
148154,3017751,555 39 STREET,3,903,144,3009030144,89,319,"HARRY BODANSKY, MALKIEL BERLIANSHIK, MICHAEL ISREAL, MICHAEL BERLIANSHIK, MICHAEL ISRAEL",UTICA VENTURES LLC,704 DEKALB AVENUE 11216,191,89
149477,3135884,1226 42 STREET,3,5598,16,3055980016,3,8,"MORDECAI SCHEINER, REBECCA SCHEINER, FRANK VARGAS, RIVKA SCHEINER",,1867 55TH STREET 11204,531,3
150016,3136244,1416 43 STREET,3,5606,11,3056060011,6,227,"JACOB FELDMAN, ELI FELDMAN, AVIGDOR BERKOWITZ, DAVID UNSDORFER, ISAAC FELDMAN","999 WILLOUGHBY AVENUE, LLC",1161 45TH STREET 11219,390,14
150017,3136245,1420 43 STREET,3,5606,13,3056060013,6,227,"JACOB FELDMAN, ELI FELDMAN, AVIGDOR BERKOWITZ, DAVID UNSDORFER, ISAAC FELDMAN","999 WILLOUGHBY AVENUE, LLC",1161 45TH STREET 11219,390,14
150018,3136246,1424 43 STREET,3,5606,15,3056060015,7,38,"ABRAHAM LESER, DAVID FUHRER, BENNY BENIAKER, BENZION BENIAKER, EDITH LESER",43RD REALTY GROUP LLC,1481 47TH STREET 11219,343,7
152025,3011974,642 46 STREET,3,758,23,3007580023,4,14,"BING QING ZHENG, XIU ZHU CHEN, LONG CHEN, QING ZHENG, YONG YOU",YBL REALTY LLC,762 STREET 4D 11232,356,4
153410,3137439,1225 49 STREET,3,5634,7501,3056347501,2,17,"THOMAS WEISS, RUTH HRONCICH, THOMAS WEWISS",1225 49 STREEET CONDO,1225 49TH 11219,533,2
155849,3013966,580 52 STREET,3,808,37,3008080037,19,164,"JACQUELINE ARROYO, MARIO VALDES, DELVIS VALDES",BROOKLYN MANAGEMENT CORP,4505 FIFTH AVENUE 200 11220,353,19
156599,3014251,452 53 STREET,3,815,29,3008150029,3,64,"SHOLOM RUBASHKIN, SHOLOM RINASHKIZ, SHALOM RIBOSHKIN, SHOLOM RUBOSHLEIN",452 53RD ST REATY CORP,580 CROWN STREET 306 11213,360,3
156600,3014252,456 53 STREET,3,815,31,3008150031,3,64,"SHOLOM RUBASHKIN, SHOLOM RINASHKIZ, SHALOM RIBOSHKIN, SHOLOM RUBOSHLEIN",452 53RD ST REATY CORP,580 CROWN STREET 306 11213,360,3
156734,3014425,740 53 STREET,3,818,24,3008180024,58,904,"MARC KATZ, RONG CHEN, ISAAC NEGER, HUO MING ZHANG, ISSAC KATZ",MING RONG REALTY INC,3900 12TH AVENUE 11218,29,58
158829,3015061,529 56 STREET,3,832,66,3008320066,2,12,"CATHERINE KOURETSOS, MARY KATSAROS",,7706 SIXTH AVENUE 11209,361,2
162118,3143442,484 60 STREET,3,5782,37,3057820037,1,6,"QI BAO DONG, QI BO DONG",JADE DRAGON REALTY INC.,484 60TH STREET 11220,535,1
166440,3144443,258 67 STREET,3,5849,29,3058490029,1,6,"ROBERT SALGADO, CECILIA WANCEL",,258 67TH STREET APT1F 11220,536,1
169218,3158639,2070 72 STREET,3,6196,35,3061960035,1,9,"SAFET BAJROVIC, CAZIM BAJROVIC",2070 REALTY LLC,2070 72ND STREET C1 11204,538,1
174248,3161617,2041 78 STREET,3,6251,61,3062510061,1,6,"VITO COMO, FRANCESCA COMO, ANDREA COMO",,2041 78TH STREET 11214,539,1
177760,3152179,568 82 STREET,3,6009,29,3060090029,61,921,"NIKOLAOS LEONARDOS, RAMIN AHDOOT, MATTHEW AHDOOT, ENRICO FERDICO, AZZAM OBEID","DAFNONAS ESTATES, LTD",308 84TH STREET 11209,13,1581
182694,3059067,293 ADELPHI STREET,3,2104,14,3021040014,3,14,"JOSEPH JONES, ANN JONES, JOSPEH JONES",JONES & JONES REALTY MGMT LLC,293 ADELPHI STREET T 11205,391,3
183117,3096315,655 ALABAMA AVENUE,3,4296,65,3042960065,3,16,"JOHN FRANCOIS, NADER SOHRABI, JOHN ANTOINE, JOHN FRANCIOS, JOHN FRANCIS",251 W 121 NYC LLC,251 WEST 121ST 10027,207,3
183203,3035630,119 ALBANY AVENUE,3,1340,5,3013400005,54,398,"MOSHE DEUTSCH, ZALMEN WAGSCHALL, MOSHE DEUTCH, MOSHE DEUCH, ZALMEN WAGSCHAL",FINDLAY ESTATES LLC,1049 EAST 15TH STREET 11230,7,766
184797,3086823,53 ARLINGTON AVENUE,3,3917,23,3039170023,28,394,"JACOB SACKS, KARI HOROWITZ, JAMES WISEMAN",CCM PROPERTY MANAGEMENT LLC,217 HAVEMEYER STREET FLR4 11211,477,28
184798,3086822,55 ARLINGTON AVENUE,3,3917,22,3039170022,15,138,"SCOTT ROSENTHAL, WILLIAM MOORE, SCOTT ROSERTHAL, CECIL FANCEY, SCOTT ROSENTHALL",CHARTERED PROPERTIES LLC,1199 PARK AVENUE 8D 10128,375,15
184911,3088610,282 ASHFORD STREET,3,3983,20,3039830020,3,12,"AMNON TOUAF, NATHAN THOMAS, NATHANIEL THOMAS, LAMONT TOUSSAINT",UNCLE SAM MANAGEMENT LLC,24019 JAMAICA AVENUE 02 11426,253,59
185387,3089333,209 ATKINS AVENUE,3,4023,7,3040230007,14,267,"MAYER BRACH, JACOB FELDMAN, ELI FELDMAN, SOL BRACH, SIMCHA TEITELBAUM",MBC GROUP LLC,55 FRANKLIN AVENUE B1 11205,390,14
185439,3089896,315 ATKINS AVENUE,3,4055,7,3040550007,1,8,FRANKY DUKE,,315 ATKINS AVENUE 11208,509,1
185969,3038651,2342 ATLANTIC AVENUE,3,1436,11,3014360011,29,328,"RAMIEL BEN YEHUDA, RAMIEL BENYEHUDA, RAMIEL BEN-YEHUDA, ISAAC ABRAHAM, RAMIEL YEHUDA",BRIGHTON MANAGEMENT,12 EAST 44TH STREET 700 10017,83,29
186156,3087868,2869 ATLANTIC AVENUE,3,3950,46,3039500046,35,247,"ARMANDO DEMARINO, VICTOR CARELLA, ANDRZEJ ROTH, ARMANDO DE MARINO, ANDREW ROTH",ARMCRES REALTY INC.,6106 MYRTLE AVENUE 11385,85,90
186157,3087867,2873 ATLANTIC AVENUE,3,3950,44,3039500044,52,1109,"JAY GOLD, MICHAEL NEDD, SHUEY SCHEINER, SANDRA RAMIREZ, JAVIER MEJIA",A H I,549 EMPIRE BOULEVARD 100 11225,386,52
186806,3093484,376 AUTUMN AVENUE,3,4168,29,3041680029,55,751,"JONATHAN KOWITZ, JOSH KOWITZ, OSCAR KOHN, MARK KOHN, DEBBY KOHN",CSN PROPERTIES,858 BECK STREET B2 10459,263,56
186919,3095563,595 AUTUMN AVENUE,3,4254,12,3042540012,102,748,"JOE REDEK, JOE RETEK, JOEL RETEK, MORDECHAI RETEK, BERL HOROWITZ",WILLIAMSBURG PROPERTY MANAGEMENT LLC,455 PARK AVENUE 11205,7,766
194080,3189915,110 AVENUE S,3,7079,5,3070790005,6,46,"BORIS TANSKY, OLEG KRASNITSKIY, ALEX NOVIKOV, OLEG KRASNITSRIY, OLEG KRASNITSKY",223 NEPTUNE AVENUE LLC,101 AVENUE U 11223,543,6
196271,3200861,1714 AVENUE V,3,7378,6,3073780006,2,18,"PATRICIA DONAHUE-HIGGINS, PATRICIA DONAHUE- HIGGINS, PATRICIA DONAHUE -HIGGINS",,424 BEACH 135TH STREET 11694,545,2
197912,3047851,214 BAINBRIDGE STREET,3,1687,10,3016870010,1,7,"DARRELL DARWOOD, CHARLES HEDGEPETH",DARWOOD PROPERTIES LLC,214 BAINBRIDGE 11233,447,1
197917,3047616,221 BAINBRIDGE STREET,3,1682,79,3016820079,15,43,"AVIAD RAVE, PAMILA MAHABIR, NADYA KRASNIKAVA, NADZEYA KRASNIKAVA, STEPHANIE WILLIAMSON",75 ELDERT STREET LLC,1636 EASTERN PARKWAY 11233,425,15
197936,3047862,242 BAINBRIDGE STREET,3,1687,25,3016870025,29,328,"RAMIEL BEN YEHUDA, RAMIEL BENYEHUDA, RAMIEL BEN-YEHUDA, ISAAC ABRAHAM, RAMIEL YEHUDA",BRIGHTON MANAGEMENT,12 EAST 44TH STREET 700 10017,83,29
197938,3047863,244 BAINBRIDGE STREET,3,1687,26,3016870026,29,328,"RAMIEL BEN YEHUDA, RAMIEL BENYEHUDA, RAMIEL BEN-YEHUDA, ISAAC ABRAHAM, RAMIEL YEHUDA",BRIGHTON MANAGEMENT,12 EAST 44TH STREET 700 10017,83,29
197986,3047692,295 BAINBRIDGE STREET,3,1683,80,3016830080,9,41,"YOEL SALCER, SHIA KATZ, CHAIM SCHWARTZ, FELIX RAYAS, FELIX REYES",2360 PACIFIC INC,114 SANFORD STREET 11205,406,61
198183,3040891,540 BAINBRIDGE STREET,3,1510,28,3015100028,14,80,"OREN HAKIM, MOURIS NASSIRI, OREN HOKIM, OREN HOKLIN",333 VERNON LLC,10 CLERMONT AVENUE 1R 11205,349,14
198190,3040894,548 BAINBRIDGE STREET,3,1510,31,3015100031,3,13,"GLEN JOSEPH, PRISCILLA JOSEPH",ESTATE OF ENA & JAMINA ISAAC,165 RUTLAND ROAD 11225,432,3
198944,3090424,651 BARBEY STREET,3,4077,8,3040770008,1,6,"HALVERSON WILLIAMS, DEBRA WILLIAMS",,651 BARBEY STREET 11207,510,1
201200,3166422,63 BAY 14 STREET,3,6365,13,3063650013,1,6,"SELYNA ENG, TONY ENG",,219 WEST 100TH STREET 2E 10025,541,1
205477,3050322,1063 BEDFORD AVENUE,3,1797,3,3017970003,29,313,"ALEXANDER HORN, SAM KOORIS, CURTIS STORY, ALEX HORN, SAMUEL KOORIS",INWICK PARTNERS LLC,160 BROADWAY 501 10038,239,29
205586,3057460,1238 BEDFORD AVENUE,3,2000,24,3020000024,8,43,"SEAN SEDAGHATPOUR, SEAN SED, SEAN JOSHUA",36 HENDRIX LLC,350 NORTHERN BOULEVARD 310 11021,448,8
205615,3029754,1319 BEDFORD AVENUE,3,1200,4,3012000004,65,452,"JOEL FEKETE, MOSES POLLAK, J FEKETE, M POLLAK, S BREUER",METROPOLITAN TERRACE LLC,63 FLUSHING AVENUE 299 11205,387,65
207678,3095390,964 BELMONT AVENUE,3,4249,16,3042490016,4,103,"ISAAC MENCZER, MARK FRIEDMAN, ISSAC MENCZER",GIT LEB LLC,305 BERRY STREET BSMT 11249,513,4
208577,3038871,1935 BERGEN STREET,3,1446,46,3014460046,8,57,"SOLOMON HALBERSTAM, CHAIM SCHWARTZ, SINAI HALBERSTAM, MOSES STERN, EDILBERTO LOPEZ",AAA GROUP MANAGEMENT,139 LORIMER STREET 11206,407,8
208597,3038937,1967 BERGEN STREET,3,1447,71,3014470071,6,29,"URI KOPTIEV, MICHAEL KMAKSMOOR, MICHAEL KHAKSHOOR, URI KOPTIEV KOPTIEV, ALBERT ARANBAEV",701-703 LLC,36 WEST 47TH STREET 603 10036,347,6
208652,3039108,2044 BERGEN STREET,3,1454,22,3014540022,51,1277,"ROBERT RAPHAEL, NELSON COLON, LUIS RUIZ, ISRAEL ACEVEDO, WINSTON KING",GILMAN MANAGEMENT CORP.,55 WATERMILL LANE 100 11021,27,51
208753,3326008,255 BERGEN STREET,3,197,55,3001970055,17,128,"KASHEEM JONES, COLETTE FORD, STELLA ARSENAKOS, GEORGE RUOTOLO, JOHNNIE WHITE",LANDLORD MANAGEMENT LLC,44 COURT STREET 1217 11201,232,17
208780,3005991,342 BERGEN STREET,3,389,26,3003890026,41,316,"EDEN ASHOURZADEH, CATHERINE LLOPIS, JACKIE ORTIZ, ALEX KAHEN, ROBERT KAYDANIAN",296-298 NORTH 8TH STREET LLC,377 PARK AVENUE SOUTH 5FLOOR 10016,256,46
209089,3028292,870 BERGEN STREET,3,1149,14,3011490014,14,94,"BRIAN GAMORY, DONALD MINERVA, BRIAN GAMOY, BRIAN GAMDRY, MINERVA DONALD",THE LUWIFREN CORPORATION,443 FOURTH STREET 11215,367,14
209769,3117664,2107 BEVERLEY ROAD,3,5125,74,3051250074,7,72,"WANDA NICHOLSON, LINFORD BLAGROVE, JEAN MOCOMBE, ANTHONY WEEKES, CARLTON WEEKES",EXPLORE REALTY CORP,50 COURT STREET 512 11201,393,7
210672,3075649,166 BLEECKER STREET,3,3306,24,3033060024,43,510,"EVITA LUCENKO, MICHAEL SHAH, LUIS FEIJOO, VERONICA HUMPHRIES, HARBI CORONEL",DS BROOKLYN PORTFOLIO OWNER LLC,114 EAST 13TH STREET FRNT1 10003,30,43
210794,3075829,424 BLEECKER STREET,3,3312,18,3033120018,42,322,"EDEN ASHOURZADEH, CATHERINE LLOPIS, JACKIE ORTIZ, ALEX KAHEN, ROBERT KAYDANIAN",296-298 NORTH 8TH STREET LLC,377 PARK AVENUE SOUTH 5FLOOR 10016,256,46
211426,3084581,454 BRADFORD STREET,3,3792,38,3037920038,184,2008,"ISMENE SPELIOTIS, DARIO RODRIGUEZ, HOPE BURGESS, DAN STADT, SALVATORE D'AVOLA","MHANY MANAGEMENT, INC.",1 METRO TECH CENTER NORTH 11FLOOR 11201,13,1581
211576,3083195,9 BRADFORD STREET,3,3664,19,3036640019,29,198,"SAMUEL FRAIFELD, YOSEF ARIEL, YOSSEF ARIEL, ARNESA CEKIC, YISROEL KOTLARSKY",STE MANAGEMENT LLC,936 FULTON STREET 11238,340,29
213531,3082579,531 BRISTOL STREET,3,3613,9,3036130009,99,2106,"MOSES MIZRAHI, JOE FALKOWITZ, ALEX KOHEN, JACOB HAS, MARINO RODRIGUEZ",WASHINGTON TOWERS LLC,81 PULASKI STREET 103 11206,182,163
214308,3071765,863 BROADWAY,3,3135,7,3031350007,50,899,"ARI WORCH, DUVI BRUNNER, MEYER APPEL, JOEL MITTELMAN, CHAIM LANDAU",LEX GRAND HOLDINGS LLC,143 DIVISION AVENUE 11211,7,766
214795,3054006,29 BROOKLYN AVENUE,3,1869,7,3018690007,111,2042,"MARCUS RENARD, DAVID SCHORR, DORON YAGHOUBI, JAIR GUTIERREZ, MARGARET GROSSMAN","471-476 CENTRAL PARK WEST PROPERTY OWNER, LLC",256 WEST 116TH STREET 3FLOOR 10026,102,111
214929,3030113,92 BROOKLYN AVENUE,3,1208,45,3012080045,3,19,PAZ PETERS,,225 HANCOCK STREET 11216,394,3
214930,3030114,94 BROOKLYN AVENUE,3,1208,46,3012080046,3,19,PAZ PETERS,,225 HANCOCK STREET 11216,394,3
215399,3048241,33 BUFFALO AVENUE,3,1712,11,3017120011,15,92,"CHAIM GOLDBERGER, MIRIAM KOHN, CHAIM GOLDBERSER, CHAIM GOLDBERSER SR, JOEL WEINSTEIN",HENRY MANAGEMENT LLC,503 LAFAYETTE AVENUE B 11205,389,15
216098,3072012,606 BUSHWICK AVENUE,3,3160,32,3031600032,58,2005,"JACOB HAGER, NAFTALI HAGER, RAMIRO ATITLA, MIGUEL RODRIGUEZ, JUAN QUEZADA",HAGER MANAGEMENT INC,266 BROADWAY 604 11211,265,58
216252,3074965,920 BUSHWICK AVENUE,3,3283,35,3032830035,52,552,"IVAN VILLARRUEL, ALEX ABREU, RYAN VILLARRUEL, LUIS NAVARRO, JERRY ATKINS","SAFEGUARD REALTY MGMT, INC",120 WEST 31ST STREET 6FLOOR 10001,85,90
216271,3075292,946 BUSHWICK AVENUE,3,3294,16,3032940016,52,552,"IVAN VILLARRUEL, ALEX ABREU, RYAN VILLARRUEL, LUIS NAVARRO, JERRY ATKINS","SAFEGUARD REALTY MGMT, INC",120 WEST 31ST STREET 6FLOOR 10001,85,90
218643,3075624,324 CENTRAL AVENUE,3,3305,42,3033050042,2,14,"MARTIN STEIN, JOEL ISRAEL, ZALMY KAF",128 ENTERPRISE LLC,1455 49TH STREET 5H 11219,473,2
218950,3041003,278 CHAUNCEY STREET,3,1513,14,3015130014,10,65,"MICHAEL KHODADADIAN, NIKITA TAYLOR, MOSHE NIR, KEITH BROWN, ABRAHAM NIR",K26 GROUP 2 LLC,1910 EASTERN PARKWAY 11223,187,10
218972,3040816,319 CHAUNCEY STREET,3,1508,71,3015080071,2,128,"RICHARD BEST, CASSANDRA BROWN-BEST, KRISTEN HACKETT, RENE FIGUEROA, DEBRA TRAVIS","ROBERT E. HILL, INC.",319 CHAUNCEY STREET 3R 11233,326,2
219004,3040877,375 CHAUNCEY STREET,3,1509,66,3015090066,17,492,"ADAM COHEN, AMIR COHEN, ILAN COHEN, RADHAMES ACOSTA, ISRAEL GLASER",ELITE MANAGEMENT LLC,183 PINEHURST AVENUE 10033,216,17
219065,3040917,459 CHAUNCEY STREET,3,1510,63,3015100063,5,41,"MARIAM FAROOQ, JOSE AGUDO ORTIZ, JAMES BENALCAZAR, JAIME BENALCAZAR, JOSE AGUDO-ORTIZ",MANIFOOKI PROPERTIES,47 ADELPHI GARAJE 11205,345,5
219093,3040906,487 CHAUNCEY STREET,3,1510,50,3015100050,41,206,"CHAIM FRIEDMAN, MAYER FRIEDMAN, YOCHEVED PERLSTEIN, JOSEF PERLSTEIN, YITZCHOK KOHN",ROGERS PLAZA LLC,149 RODNEY STREET 11211,7,766
219096,3040905,489 CHAUNCEY STREET,3,1510,49,3015100049,78,609,"MOSHE DEUTSCH, MOSHE DEUTCH, ZALMEN WAGSCHALL, MOSHE DEUCH, ZALMEN WAGSCHAL",FINDLAY ESTATES LLC,1049 EAST 15TH STREET 11230,7,766
219693,3092134,193 CHESTNUT STREET,3,4128,8,3041280008,10,41,"ZANNIS ANGELIDAKIS, STAVROS KANAKIS, MARIA BARQUERO, STRVROS KANAKIS, STAVOR KANAKIS",ZANKERA LLC,15253 TENTH AVENUE 226 11357,512,10
219695,3092133,197 CHESTNUT STREET,3,4128,7,3041280007,10,41,"ZANNIS ANGELIDAKIS, STAVROS KANAKIS, MARIA BARQUERO, STRVROS KANAKIS, STAVOR KANAKIS",ZANKERA LLC,15253 TENTH AVENUE 226 11357,512,10
219987,3085862,565 CHRISTOPHER AVENUE,3,3856,6,3038560006,4,23,"JOSEPH CODISPOTI, MITCH ASHER, BRUNO CODISPOTI, CARL TERMINE JR., JUAN RODRIGUEZ",MAG REALTY CORP.,475 WASHINGTON AVE 2C 11238,377,4
220781,3119709,2408 CLARENDON ROAD,3,5190,3,3051900003,2,22,"KEVIN CAHILL, LAWRENCE PRICE, KEVIN FORSYTH, BRENT SUBRAN",COMMERCIAL REALTY RESOLUTION LLC,829 EAST TENTH STREET 2H 11230,481,2
221531,3054645,173 CLASSON AVENUE,3,1896,15,3018960015,26,209,"ELIE BASSALIAN, STEVEN KACHANIAN, EDWIN HURTADO, GEOVANNY VENTURA, ANGEL RIVERA",BLUESKY MANAGEMENT,11 MIDDLE NECK ROAD SUITE 11021,81,28
222337,3090543,690 CLEVELAND STREET,3,4080,33,3040800033,105,1409,"MATT LEVI, ALEX KOHN, JESSICA LEE, ARON KAPELUSCHNIK, HENRY MIZRAHI",JWASSER,1261 39TH STREET 3RD FL 11218,35,168
222658,3050167,338 CLIFTON PLACE,3,1794,8,3017940008,87,979,"JOSH SHINE, SHIMON LEITER, DOVY ANDRUSIER, SAM STERN, DAVID KUGEL",THE SHINE CORP,781 EAST NEW YORK AVENUE 3 11203,71,89
223181,3004775,426 CLINTON STREET,3,350,28,3003500028,82,1254,"JOHN CATALIC, ENIS CECUNJANIN, MICHAEL BESEN, RIKIN SHETH, JACOB GOLD",NEW YORK CITY MANAGEMENT,381 PARK AVENUE SOUTH 1515 10016,1,90
225235,3118229,695 CONEY ISLAND AVENUE,3,5141,237,3051410237,67,958,"NIKOLAOS LEONARDOS, ABDUL AWAN, RAMIN AHDOOT, MATTHEW AHDOOT, ENRICO FERDICO","DAFNONAS ESTATES, LTD",308 84TH STREET 11209,13,1581
225237,3118211,697 CONEY ISLAND AVENUE,3,5141,137,3051410137,9,50,"ABDUL AWAN, BAKHAT AWAN, NIKOLAS LEONARDOS, NASIR AWAN",ABDUL JALIL AWAN,7914 13TH AVENUE PVT 11228,13,1581
225239,3118209,703 CONEY ISLAND AVENUE,3,5141,135,3051410135,9,50,"ABDUL AWAN, BAKHAT AWAN, NIKOLAS LEONARDOS, NASIR AWAN",ABDUL JALIL AWAN,7914 13TH AVENUE PVT 11228,13,1581
225257,3118200,735 CONEY ISLAND AVENUE,3,5141,122,3051410122,4,21,"CHOUDARY AHMAD, NAZIR BEGUM",GONDAL ESTATE 1 LLC,637 BANNER AVENUE 11235,526,4
225699,3079947,110 COOPER STREET,3,3440,12,3034400012,2,8,"BEN RASABI, BAROUCH ABARGEL, ASAF YEMINI, ALPHA PHILMON",145-11 JAMAICA AVE. CORP,14511 JAMAICA AVENUE 11435,500,2
225814,3080048,276 COOPER STREET,3,3443,16,3034430016,44,556,"ALEX KOHN, ARON KAPELUSCHNIK, MATT LEVI, SOL DAY, ERDON TOPALLI",BK WEST 36TH STREET HOLDINGS LLC,1261 39TH STREET 11218,35,168
225860,3079692,63 COOPER STREET,3,3433,63,3034330063,42,590,"MATT LEVI, HENRY WRIGHT, ALEX KOHN, GAVINO PALACIOS, CAROL NAVARRO",MEM505 LLC,1261 39TH STREET 3RD FL 11218,35,168
226320,3077756,396 CORNELIA STREET,3,3386,24,3033860024,4,112,"STEPHAN TCHORBAJIAN, MICHAEL GROSS, NICHAN TCHORBAJIAN, BERNARD GROSS, ALLAN LEBOVITS",EMERSON PROPERTY MANAGEMENT LLC,316A HIMROD STREET 2 11237,460,4
227102,3326316,24 COVERT STREET,3,3420,18,3034200018,4,33,"ISAAC MANDELBAUM, ISAAC MANDALBAUM, ISAAC MADELBAUM, RICKY JONES",COVERT ST. REALTY,4403 15TH AVENUE 331 11219,314,4
227581,3091671,114 CRESCENT STREET,3,4118,27,3041180027,3,20,"PEDRO NOMBERTO, INES NOMBERTO",114 CRESCENT LLC,13547 114TH PLACE 11420,352,3
227821,3095749,620 CRESCENT STREET,3,4267,34,3042670034,12,46,"SIMON MARKOVITZ, REUVEN SOBEL, HINDY SOBEL, BELLA STEINMETZ, HINDY KLEIN",302 SUMPTER LLC,266 47TH STREET 11220,424,12
229978,3073542,1365 DE KALB AVENUE,3,3234,47,3032340047,1,6,"JOHN BRENNAN, THOMAS BRENNAN, JOSEPH BRENNAN, ELIZABETH BRENNAN",LACEY LLC,209 TENTH STREET 07030,483,1
229987,3073800,1380 DE KALB AVENUE,3,3245,28,3032450028,197,1208,"MATTHEW AHDOOT, NIKOLAOS LEONARDOS, RAMIN AHDOOT, ENRICO FERDICO, AZZAM OBEID",UNITED FRANKLIN LLC,14718 HILLSIDE AVENUE 11435,13,1581
229996,3073819,1416 DE KALB AVENUE,3,3246,12,3032460012,1,6,JOHN SIRAGUSA,,16024 80TH STREET 11414,487,1
